Cites,Authors,Title,Year,Source,Publisher,ArticleURL,CitesURL,GSRank,QueryDate,Type,DOI,ISSN,CitationURL,Volume,Issue,StartPage,EndPage,ECC,CitesPerYear,CitesPerAuthor,AuthorCount,Age,Abstract,FullTextURL,RelatedURL
8,"M Kakulia, N Gigineishvili","The primary objectives and priorities of monetary policy in Georgia",2005,"Problems of Economic Transition","Taylor &Francis","https://www.tandfonline.com/doi/abs/10.1080/10611991.2005.11049987","https://scholar.google.com/scholar?cites=8598693174985283801&as_sdt=2005&sciodt=0,5&hl=en",719,"2023-02-08 13:47:29","","10.1080/10611991.2005.11049987","","",,,,,8,0.44,4,2,18,"… doctrine that monetary policy cannot influence long-run trends of economic growth and … flexibility and responsiveness of monetary policy to developments in the financial sphere. …","https://www.researchgate.net/profile/Merab-Kakulia/publication/5173301_The_Primary_Objectives_and_Priorities_of_Monetary_Policy_in_Georgia/links/58c7ed6892851cd9c1617232/The-Primary-Objectives-and-Priorities-of-Monetary-Policy-in-Georgia.pdf","https://scholar.google.com/scholar?q=related:2diSg-KxVHcJ:scholar.google.com/&scioq=effect+of+%22monetary+policy%22+on+%22economic+growth%22&hl=en&as_sdt=0,5"
7,"M Mehrara, AR Karsalari","Asymmetric effects of monetary shocks on economic activities: The case of Iran",2011,"Journal of Money, Investment and …","academia.edu","https://www.academia.edu/download/7370838/JMIB_20_06.pdf","https://scholar.google.com/scholar?cites=14500480042160508806&as_sdt=2005&sciodt=0,5&hl=en",720,"2023-02-08 13:47:29","PDF","","","",,,,,7,0.58,4,2,12,"… also have asymmetric effects on economic growth so that the … a negative significant effect on economic growth. Therefore, … in the monetary policy making. In this paper we consider the …","https://www.academia.edu/download/7370838/JMIB_20_06.pdf","https://scholar.google.com/scholar?q=related:hk-egcUNPMkJ:scholar.google.com/&scioq=effect+of+%22monetary+policy%22+on+%22economic+growth%22&hl=en&as_sdt=0,5"
1,"NT Nguyen, HN Vu, TH Le","Impacts of Monetary Policy on Inequality: The Case of Vietnam",2019,"Beyond Traditional Probabilistic Methods in …","Springer","https://link.springer.com/chapter/10.1007/978-3-030-04200-4_34","https://scholar.google.com/scholar?cites=18324092833360087724&as_sdt=2005&sciodt=0,5&hl=en",721,"2023-02-08 13:47:29","","10.1007/978-3-030-04200-4_34","","",,,,,1,0.25,0,3,4,"… monetary policy has a small and lagged effect on income inequality. Besides monetary policy, … to have significant impact on income inequality, while economic growth has insignificant …","","https://scholar.google.com/scholar?q=related:rIq1w1hBTP4J:scholar.google.com/&scioq=effect+of+%22monetary+policy%22+on+%22economic+growth%22&hl=en&as_sdt=0,5"
7,"J Kitchen","Effects of monetary and fiscal policy on US agriculture",1987,"","books.google.com","https://books.google.com/books?hl=en&lr=&id=iQQUAAAAYAAJ&oi=fnd&pg=PA3&dq=effect+of+%22monetary+policy%22+on+%22economic+growth%22&ots=B_BS7oOByM&sig=EIps0HRyor3bQ28sl9fM6p4glYI","https://scholar.google.com/scholar?cites=1021651668956019247&as_sdt=2005&sciodt=0,5&hl=en",722,"2023-02-08 13:47:29","BOOK","","","",,,,,7,0.19,7,1,36,"… However, sustained expansionary monetary policy can have uncertain longrun effects, … monetary policy, on the other hand, would raise real interest rates and slow economic growth. …","https://books.google.com/books?hl=en&lr=&id=iQQUAAAAYAAJ&oi=fnd&pg=PA3&dq=effect+of+%22monetary+policy%22+on+%22economic+growth%22&ots=B_BS7oOByM&sig=EIps0HRyor3bQ28sl9fM6p4glYI","https://scholar.google.com/scholar?q=related:L_pOrMeiLQ4J:scholar.google.com/&scioq=effect+of+%22monetary+policy%22+on+%22economic+growth%22&hl=en&as_sdt=0,5"
0,"EAK Fseifes, EM Alhaj Yousef","The Effectiveness of Monetary Policy in Jordan during the Period 1992-2019",2022,"Iranian Economic Review","ier.ut.ac.ir","https://ier.ut.ac.ir/article_89089.html","",723,"2023-02-08 13:47:29","","","","",,,,,0,0.00,0,2,1,"… role of monetary policy in enhancing the economic growth, while … the impact of monetary policy on economic growth at the … the impact of monetary policy on economic growth in Jordan. …","https://ier.ut.ac.ir/article_89089_dfddc0af8a2ad5a58dc1b4217c5de2d3.pdf","https://scholar.google.com/scholar?q=related:ZAx4bu6fzfwJ:scholar.google.com/&scioq=effect+of+%22monetary+policy%22+on+%22economic+growth%22&hl=en&as_sdt=0,5"
2,"B Nidhiprabha","Economic growth, monetary policy, and dollarization in CLMV Countries",2017,"Dollarization and De-dollarization in Transitional …","Springer","https://link.springer.com/chapter/10.1007/978-3-319-57768-5_6","https://scholar.google.com/scholar?cites=8233339311390654366&as_sdt=2005&sciodt=0,5&hl=en",724,"2023-02-08 13:47:29","","10.1007/978-3-319-57768-5_6","","",,,,,2,0.33,2,1,6,"… One cannot examine the benefits and costs of dollarization and the impact of dollarization on the role of monetary policy without referring to these macroeconomic and financial variables…","","https://scholar.google.com/scholar?q=related:nv-ySnuyQnIJ:scholar.google.com/&scioq=effect+of+%22monetary+policy%22+on+%22economic+growth%22&hl=en&as_sdt=0,5"
2,"MU Arshad, Z Ahmed, A Ramzan, MN Shabbir, ...","Financial inclusion and monetary policy effectiveness: A sustainable development approach of developed and under-developed countries",2021,"Plos one","journals.plos.org","https://journals.plos.org/plosone/article?id=10.1371/journal.pone.0261337","https://scholar.google.com/scholar?cites=17068225931155596229&as_sdt=2005&sciodt=0,5&hl=en",725,"2023-02-08 13:47:29","HTML","","","",,,,,2,1.00,0,5,2,"… Monetary policy is a powerful tool for a central bank to achieve its price stability, economic growth… We consider two aspects that show how monetary policy depends upon the level of …","https://journals.plos.org/plosone/article?id=10.1371/journal.pone.0261337","https://scholar.google.com/scholar?q=related:xeOjlA2F3uwJ:scholar.google.com/&scioq=effect+of+%22monetary+policy%22+on+%22economic+growth%22&hl=en&as_sdt=0,5"
1,"O Ahmed, A Mashkoor","The wrong impact of Fiscal Imbalance on economic growth and Monetary Policy consequences (A case of Pakistan)",2016,"","mpra.ub.uni-muenchen.de","https://mpra.ub.uni-muenchen.de/id/eprint/69752","https://scholar.google.com/scholar?cites=15459375067145997692&as_sdt=2005&sciodt=0,5&hl=en",726,"2023-02-08 13:47:29","","","","",,,,,1,0.14,1,2,7,"… impact of fiscal imbalance on economic growth of country through contiguous monetary policy … The purpose of the empirical study is to determine the solution of monetary policy which …","https://mpra.ub.uni-muenchen.de/69752/1/MPRA_paper_69752.pdf","https://scholar.google.com/scholar?q=related:fI3EXre7itYJ:scholar.google.com/&scioq=effect+of+%22monetary+policy%22+on+%22economic+growth%22&hl=en&as_sdt=0,5"
3,"Y Song, Y Yang, J Yu, Z Zhao","The Post-COVID-19 Economic Policy Uncertainty and the Effectiveness of Monetary Policy: Evidence From China",2021,"Frontiers in public health","frontiersin.org","https://www.frontiersin.org/articles/10.3389/fpubh.2021.771364/full","https://scholar.google.com/scholar?cites=16353173005555100184&as_sdt=2005&sciodt=0,5&hl=en",727,"2023-02-08 13:47:29","HTML","10.3389/fpubh.2021.771364","","",,,,,3,1.50,1,4,2,"… and slow economic growth. Hence, it is vitally important for the central bank to improve monetary policy effectiveness and reduce EPU as the goals of monetary policy typically include …","https://www.frontiersin.org/articles/10.3389/fpubh.2021.771364/full","https://scholar.google.com/scholar?q=related:GGqeqjQk8uIJ:scholar.google.com/&scioq=effect+of+%22monetary+policy%22+on+%22economic+growth%22&hl=en&as_sdt=0,5"
91,"C Vrolijk","Derivatives effect on monetary policy transmission",1997,"","books.google.com","https://books.google.com/books?hl=en&lr=&id=AFoYEAAAQBAJ&oi=fnd&pg=PA4&dq=effect+of+%22monetary+policy%22+on+%22economic+growth%22&ots=mdOTUye1Ow&sig=f8tYaSKs3wspTb5LtpZ2ft4NsYE","https://scholar.google.com/scholar?cites=4403015230273834908&as_sdt=2005&sciodt=0,5&hl=en",728,"2023-02-08 13:47:29","BOOK","","","",,,,,91,3.50,91,1,26,"… Investment drops and directly leads to a decline in aggregate demand, slowing down economic growth and tempering inflationary pressures. An increase in the nominal interest rate …","https://www.elibrary.imf.org/openurl?genre=articlel&issn=1018-5941&volume=1997&issue=121&artnum=A001","https://scholar.google.com/scholar?q=related:nE8bFQanGj0J:scholar.google.com/&scioq=effect+of+%22monetary+policy%22+on+%22economic+growth%22&hl=en&as_sdt=0,5"
37,"SN Ibeabuchi","Overview of monetary policy in Nigeria",2007,"Economic and Financial Review","dc.cbn.gov.ng","https://dc.cbn.gov.ng/efr/vol45/iss4/1/","https://scholar.google.com/scholar?cites=11096954801659262347&as_sdt=2005&sciodt=0,5&hl=en",729,"2023-02-08 13:47:29","","","","",,,,,37,2.31,37,1,16,"… In order to ensure the realization of the goals of price stability and economic growth, the CBN deploys its monetary policy instruments in such a way as to ensure optimality in inflation …","https://dc.cbn.gov.ng/cgi/viewcontent.cgi?article=1034&context=efr","https://scholar.google.com/scholar?q=related:izV3EZlNAJoJ:scholar.google.com/&scioq=effect+of+%22monetary+policy%22+on+%22economic+growth%22&hl=en&as_sdt=0,5"
1,"O Ahmed, A Mashkoor","The Wrong Impact of Fiscal Imbalance on Economic Growth and Monetary Policy Consequences: A Case Study of Pakistan",2016,"Available at SSRN 2739431","papers.ssrn.com","https://papers.ssrn.com/sol3/papers.cfm?abstract_id=2739431","https://scholar.google.com/scholar?cites=888875713910759898&as_sdt=2005&sciodt=0,5&hl=en",730,"2023-02-08 13:47:29","","","","",,,,,1,0.14,1,2,7,"… impact of fiscal imbalance on economic growth of country through contiguous monetary policy … The purpose of the empirical study is to determine the solution of monetary policy which …","https://www.academia.edu/download/37173551/Fiscal_Imbalace.pdf","https://scholar.google.com/scholar?q=related:2mEfmcDrVQwJ:scholar.google.com/&scioq=effect+of+%22monetary+policy%22+on+%22economic+growth%22&hl=en&as_sdt=0,5"
1,"MG Kifa","Economic Growth and Unemployment Under Alternative Monetary Policy Regimes: Evidence from South Africa",2014,"","search.proquest.com","https://search.proquest.com/openview/7c90db48ba115de5d1c5962d1ece0c5e/1?pq-origsite=gscholar&cbl=2026366&diss=y","https://scholar.google.com/scholar?cites=4828731836163360454&as_sdt=2005&sciodt=0,5&hl=en",731,"2023-02-08 13:47:29","BOOK","","","",,,,,1,0.11,1,1,9,"… The primary objective of this dissertation was to investigate the impact of monetary policy instruments on economic growth and unemployment in South Africa. The main objective was …","https://ujcontent.uj.ac.za/esploro/fulltext/graduate/Economic-growth-and-unemployment-under-alternative/9912931007691?repId=125131190007691&mId=135812660007691&institution=27UOJ_INST","https://scholar.google.com/scholar?q=related:xgYjcgUaA0MJ:scholar.google.com/&scioq=effect+of+%22monetary+policy%22+on+%22economic+growth%22&hl=en&as_sdt=0,5"
2,"Y Sova, I Lukianenko","Empirical evaluation of monetary policy transmission to stock markets and further transfer of macroeconomic shocks to the real sector",2022,"Journal of International Studies","jois.eu","https://www.jois.eu/files/8_1161_Sova_Lukianenko.pdf","https://scholar.google.com/scholar?cites=2173888202103026165&as_sdt=2005&sciodt=0,5&hl=en",732,"2023-02-08 13:47:29","PDF","","","",,,,,2,2.00,1,2,1,"… that monetary policy actions are further transmitted to the real economic growth through financial … appeared to be not significant for the economic growth of the developed countries. Our …","https://www.jois.eu/files/8_1161_Sova_Lukianenko.pdf","https://scholar.google.com/scholar?q=related:9XHDU80zKx4J:scholar.google.com/&scioq=effect+of+%22monetary+policy%22+on+%22economic+growth%22&hl=en&as_sdt=0,5"
0,"H Keshavarz, H Parsa","The effect of Trusting Monetary Authority on the Impact of Monetary Policy",2019,"Economic Strategy","econrahbord.csr.ir","http://econrahbord.csr.ir/article_107510.html?lang=en","",733,"2023-02-08 13:47:29","","","","",,,,,0,0.00,0,2,4,"… institutional factors determining the effectiveness of monetary policy is trust in the monetary … economic growth and reduce inflation. In this regard, this study attempts to model the effect of …","http://econrahbord.csr.ir/article_107510_ae7099f027323f241497eaaff3b6d7e8.pdf","https://scholar.google.com/scholar?q=related:IlzfGlE8ptEJ:scholar.google.com/&scioq=effect+of+%22monetary+policy%22+on+%22economic+growth%22&hl=en&as_sdt=0,5"
1,"P Dörr, P Dörr","Monetary Policy",2018,"The Impact of Monetary Policy on Economic Inequality","Springer","https://link.springer.com/chapter/10.1007/978-3-658-24835-2_2","https://scholar.google.com/scholar?cites=17155302904809951791&as_sdt=2005&sciodt=0,5&hl=en",734,"2023-02-08 13:47:29","","10.1007/978-3-658-24835-2_2","","",,,,,1,0.20,1,2,5,"… SQUIRE (1998)), an empirical validation of the monetary policy impact on the income distribution must control for economic growth. Alternatively to a monetary growth rule or an interest …","","https://scholar.google.com/scholar?q=related:L5JsZxnhE-4J:scholar.google.com/&scioq=effect+of+%22monetary+policy%22+on+%22economic+growth%22&hl=en&as_sdt=0,5"
35,"M Shirakawa","Monetary policy under the zero interest rate constraint and balance sheet adjustment",2001,"International Finance","Wiley Online Library","https://onlinelibrary.wiley.com/doi/abs/10.1111/1468-2362.00082","https://scholar.google.com/scholar?cites=15712097199704496795&as_sdt=2005&sciodt=0,5&hl=en",735,"2023-02-08 13:47:29","","10.1111/1468-2362.00082","","",,,,,35,1.59,35,1,22,"… The other is that, since monetary policy has already been … economic growth. With these evaluations in mind, this paper examines the effect of monetary policy in general and the effect of …","https://citeseerx.ist.psu.edu/document?repid=rep1&type=pdf&doi=a40706286420b423a7f1fdde3c8937e657335c24","https://scholar.google.com/scholar?q=related:m9rLKCiVDNoJ:scholar.google.com/&scioq=effect+of+%22monetary+policy%22+on+%22economic+growth%22&hl=en&as_sdt=0,5"
1,"Y Chen, Q Cheng","Investment Heterogeneity among Sectors and Asymmetric Effects of Monetary Policies: A Case Study of China's Marine Economic Development Demonstration Zone",2020,"Journal of Coastal Research","meridian.allenpress.com","https://meridian.allenpress.com/jcr/article-abstract/111/SI/198/449850","https://scholar.google.com/scholar?cites=17688146143772445847&as_sdt=2005&sciodt=0,5&hl=en",736,"2023-02-08 13:47:29","","","","",,,,,1,0.33,1,2,3,"… As China’s economy enters the ‘‘New Normal’’ monetary policy, an important tool for … sound and sustained economic growth. The present study divides the monetary policy transmission …","","https://scholar.google.com/scholar?q=related:l4zAsjPrePUJ:scholar.google.com/&scioq=effect+of+%22monetary+policy%22+on+%22economic+growth%22&hl=en&as_sdt=0,5"
0,"EO Eko, RN Orlu","Effect of Monetary Policy on Prices and Output in Nigeria",2022,"International Journal of Developing and Emerging …","tudr.org","https://tudr.org/id/eprint/1131/","",737,"2023-02-08 13:47:29","","","","",,,,,0,0.00,0,2,1,"… In their study of monetary policy and economic growth, Twinoburyo (2018) carried out a survey … between monetary policy and economic growth, the study found that monetary policy is a …","https://tudr.org/id/eprint/1131/1/Effect%20of%20Monetary%20Policy.pdf","https://scholar.google.com/scholar?q=related:eK2fWEw5J8gJ:scholar.google.com/&scioq=effect+of+%22monetary+policy%22+on+%22economic+growth%22&hl=en&as_sdt=0,5"
1,"HO OBEH, UG NWAGU","Nexus on the Responsiveness of Nigeria Economy to Monetary Policy (1986-2018)",2021,"Socialscientia: Journal of Social …","journals.aphriapub.com","https://journals.aphriapub.com/index.php/SS/article/view/1364","https://scholar.google.com/scholar?cites=4863152809694602100&as_sdt=2005&sciodt=0,5&hl=en",738,"2023-02-08 13:47:29","","","","",,,,,1,0.50,1,2,2,"… The result of the study reveals that monetary policy has a positive impact on economic growth In Nigeria. The study concluded and recommended that there is need to reduce the …","https://journals.aphriapub.com/index.php/SS/article/download/1364/1307","https://scholar.google.com/scholar?q=related:dCNK3rZjfUMJ:scholar.google.com/&scioq=effect+of+%22monetary+policy%22+on+%22economic+growth%22&hl=en&as_sdt=0,5"
11,"L Fang, L He, Z Huang","Asymmetric effects of monetary policy on firm scale in China: A quantile regression approach",2019,"Emerging Markets Review","Elsevier","https://www.sciencedirect.com/science/article/pii/S1566014118304199","https://scholar.google.com/scholar?cites=11093953742328308261&as_sdt=2005&sciodt=0,5&hl=en",739,"2023-02-08 13:47:29","","","","",,,,,11,2.75,4,3,4,"… First, we control for the rate of economic growth using the quarterly real GDP growth rate (denoted as GDP Growth). Because the real estate bubbles in the past 10 years may severely …","","https://scholar.google.com/scholar?q=related:JSIYfiak9ZkJ:scholar.google.com/&scioq=effect+of+%22monetary+policy%22+on+%22economic+growth%22&hl=en&as_sdt=0,5"
5,"Z Dong","Impact of monetary policy on economic growth in China",2012,"Advances in Information Sciences and …","The International Association for …","","https://scholar.google.com/scholar?cites=12217568127266212704&as_sdt=2005&sciodt=0,5&hl=en",740,"2023-02-08 13:47:29","CITATION","","","",,,,,5,0.45,5,1,11,"","","https://scholar.google.com/scholar?q=related:YEvW9HqFjakJ:scholar.google.com/&scioq=effect+of+%22monetary+policy%22+on+%22economic+growth%22&hl=en&as_sdt=0,5"
30,"AC Chu, L Ning, D Zhu","Human capital and innovation in a monetary Schumpeterian growth model",2019,"Macroeconomic Dynamics","cambridge.org","https://www.cambridge.org/core/journals/macroeconomic-dynamics/article/human-capital-and-innovation-in-a-monetary-schumpeterian-growth-model/18CEF15B25BBF5EC4634BA8942D8CB76","https://scholar.google.com/scholar?cites=13527864425137063557&as_sdt=2005&sciodt=0,5&hl=en",741,"2023-02-08 13:47:29","","","","",,,,,30,7.50,10,3,4,"… effects of monetary policy. In Section 3.1, we analyze the effects of the nominal interest rate on economic growth… on the effects of the nominal interest rate on economic growth and social …","https://livrepository.liverpool.ac.uk/3035149/1/human-capital.pdf","https://scholar.google.com/scholar?q=related:hUbwXQWhvLsJ:scholar.google.com/&scioq=effect+of+%22monetary+policy%22+on+%22economic+growth%22&hl=en&as_sdt=0,5"
0,"IG Okafor, JUJ Onwumere, EH Chijindu","DYNAMICS OF MONETARY POLICY TARGETS AND ECONOMIC GROWTH UNDER THE DIRECT MONETARY POLICY REGIME AND THE MARKET-BASED …",,"academia.edu","","https://www.academia.edu/download/49221494/DYNAMICS_OF_MONETARY_POLICY_TARGETS_AND_ECONOMIC_GROWTH_IN_NIGERIA.pdf","",742,"2023-02-08 13:47:29","PDF","","","",,,,,0,0.00,0,3,,"… This study will be patterned after the modified model adopted by Lionel (2014) while assessing the effect of monetary policy on economic growth in the Franc Zone. The traditional …","https://www.academia.edu/download/49221494/DYNAMICS_OF_MONETARY_POLICY_TARGETS_AND_ECONOMIC_GROWTH_IN_NIGERIA.pdf","https://scholar.google.com/scholar?q=related:bKvMcfc2rXkJ:scholar.google.com/&scioq=effect+of+%22monetary+policy%22+on+%22economic+growth%22&hl=en&as_sdt=0,5"
2,"A Komijani, ...","Measuring the Effect of Oil &Monetary Shocks on the Economic Growth of Iran",2010,"Journal of Economic …","University of Tehran","","https://scholar.google.com/scholar?cites=7031346193400536516&as_sdt=2005&sciodt=0,5&hl=en",743,"2023-02-08 13:47:29","CITATION","","","",,,,,2,0.15,1,2,13,"","","https://scholar.google.com/scholar?q=related:xB1v9htclGEJ:scholar.google.com/&scioq=effect+of+%22monetary+policy%22+on+%22economic+growth%22&hl=en&as_sdt=0,5"
7,"G Marozva","The effects of monetary policy on stock market returns and volatility: Evidence from South Africa",2020,"Academy of Accounting and Financial Studies …","search.proquest.com","https://search.proquest.com/openview/0bd15fc579ba4c0c7af3f1342300b3de/1?pq-origsite=gscholar&cbl=29414","https://scholar.google.com/scholar?cites=17757966419295064832&as_sdt=2005&sciodt=0,5&hl=en",744,"2023-02-08 13:47:29","","","","",,,,,7,2.33,7,1,3,"For several decades finance professionals have debated on the effects of monetary policy variables on stock returns. This article examines the extent to which stock returns are linked to …","","https://scholar.google.com/scholar?q=related:ANNlY1_4cPYJ:scholar.google.com/&scioq=effect+of+%22monetary+policy%22+on+%22economic+growth%22&hl=en&as_sdt=0,5"
3,"NA Fett","The Effect of Monetary Policy on Real growth Cycles",2011,"Issues in Political Economy","Citeseer","https://citeseerx.ist.psu.edu/document?repid=rep1&type=pdf&doi=066938caa0b3d54ff6161a262439ec1d19da01a0","https://scholar.google.com/scholar?cites=15252711571172716144&as_sdt=2005&sciodt=0,5&hl=en",745,"2023-02-08 13:47:29","PDF","","","",,,,,3,0.25,3,1,12,"… changes in monetary policy variables have any effect on the variance of their economic growth. … capital resulting from government manipulation of monetary policy, as the Austrians and …","https://citeseerx.ist.psu.edu/document?repid=rep1&type=pdf&doi=066938caa0b3d54ff6161a262439ec1d19da01a0","https://scholar.google.com/scholar?q=related:cG49lVyErNMJ:scholar.google.com/&scioq=effect+of+%22monetary+policy%22+on+%22economic+growth%22&hl=en&as_sdt=0,5"
23,"K Munir, A Qayyum","Measuring the effects of monetary policy in Pakistan: a factor-augmented vector autoregressive approach",2014,"Empirical Economics","Springer","https://link.springer.com/article/10.1007/s00181-013-0702-9","https://scholar.google.com/scholar?cites=12893322562046978645&as_sdt=2005&sciodt=0,5&hl=en",746,"2023-02-08 13:47:29","","10.1007/s00181-013-0702-9","","",,,,,23,2.56,12,2,9,"… This paper examines the effects of monetary policy on macroeconomic … Economic growth and price stability are the primary goals of macroeconomic policies and monetary policy …","https://mpra.ub.uni-muenchen.de/35976/2/MPRA_paper_35976.pdf","https://scholar.google.com/scholar?q=related:VepW9Y5I7rIJ:scholar.google.com/&scioq=effect+of+%22monetary+policy%22+on+%22economic+growth%22&hl=en&as_sdt=0,5"
28,"Y Hsing, WJ Hsieh","Impacts of monetary, fiscal and exchange rate policies on output in China: A VAR approach",2004,"Economics of Planning","Springer","https://link.springer.com/article/10.1007/s10644-004-7505-0","https://scholar.google.com/scholar?cites=1920202641188394929&as_sdt=2005&sciodt=0,5&hl=en",747,"2023-02-08 13:47:29","","10.1007/s10644-004-7505-0","","",,,,,28,1.47,14,2,19,"… the interest rate as a monetary policy variable, we find that in … When real M2 is chosen as a monetary policy variable, long-… a lower economic growth rate, that there was little real impact if …","","https://scholar.google.com/scholar?q=related:sRfN5CDupRoJ:scholar.google.com/&scioq=effect+of+%22monetary+policy%22+on+%22economic+growth%22&hl=en&as_sdt=0,5"
0,"KS Masalila","The influence of monetary policy on economic growth in three Southern African countries: Botswana, Malawi and Zimbabwe.",1999,"","search.proquest.com","https://search.proquest.com/openview/9d79ba1e606fda5f12140e8d6ebf1468/1?pq-origsite=gscholar&cbl=2026366&diss=y","",748,"2023-02-08 13:47:29","BOOK","","","",,,,,0,0.00,0,1,24,"… The aim of this thesis is to examine whether financial liberalisation has improved monetary policy effectiveness in Botswana, Malawi and Zimbabwe. The financial liberalisation thesis …","","https://scholar.google.com/scholar?q=related:nXNC8gSuYlgJ:scholar.google.com/&scioq=effect+of+%22monetary+policy%22+on+%22economic+growth%22&hl=en&as_sdt=0,5"
2,"HH Nguyen, TP Nguyen, ...","Impacts of monetary policy transmission on bank performance and risk in the Vietnamese market: Does the Covid-19 pandemic matter?",2022,"Cogent Business & …","Taylor &Francis","https://www.tandfonline.com/doi/abs/10.1080/23311975.2022.2094591","https://scholar.google.com/scholar?cites=11459930702902789064&as_sdt=2005&sciodt=0,5&hl=en",749,"2023-02-08 13:47:29","","10.1080/23311975.2022.2094591","","",,,,,2,2.00,1,3,1,"… monetary policy easing to boost economic growth, thereby … impact of monetary policy on bank performance and risk, there is limited evidence focusing on the impact of monetary policy …","https://www.tandfonline.com/doi/pdf/10.1080/23311975.2022.2094591","https://scholar.google.com/scholar?q=related:yAMdyUHaCZ8J:scholar.google.com/&scioq=effect+of+%22monetary+policy%22+on+%22economic+growth%22&hl=en&as_sdt=0,5"
11,"N Mughal, M Kashif, A Arif, JWG Guerrero, ...","Dynamic effects of fiscal and monetary policy instruments on environmental pollution in ASEAN",2021,"… Science and Pollution …","Springer","https://link.springer.com/article/10.1007/s11356-021-15114-8","https://scholar.google.com/scholar?cites=6783123180899876766&as_sdt=2005&sciodt=0,5&hl=en",750,"2023-02-08 13:47:29","","10.1007/s11356-021-15114-8","","",,,,,11,5.50,2,5,2,"… challenges of economic growth and environmental quality. In the perspective of economic growth, … The main objective of this study is to explore the effect of fiscal and monetary policy on …","","https://scholar.google.com/scholar?q=related:nj9BMZh-Il4J:scholar.google.com/&scioq=effect+of+%22monetary+policy%22+on+%22economic+growth%22&hl=en&as_sdt=0,5"
