Cites,Authors,Title,Year,Source,Publisher,ArticleURL,CitesURL,GSRank,QueryDate,Type,DOI,ISSN,CitationURL,Volume,Issue,StartPage,EndPage,ECC,CitesPerYear,CitesPerAuthor,AuthorCount,Age,Abstract,FullTextURL,RelatedURL
36,"RM Sousa","Wealth, asset portfolio, money demand and policy rule",2014,"Bulletin of Economic Research","Wiley Online Library","https://onlinelibrary.wiley.com/doi/abs/10.1111/j.1467-8586.2011.00431.x","https://scholar.google.com/scholar?cites=495885770382865553&as_sdt=2005&sciodt=0,5&hl=en",483,"2023-02-09 16:27:49","","10.1111/j.1467-8586.2011.00431.x","","",,,,,36,4.00,36,1,9,"… affected by monetary policy shocks, that is, I look at the impact of … ‘wealth’ effects with the role that monetary policy actions play … ), aggregate prices (GDP deflator, price of raw materials), …","","https://scholar.google.com/scholar?q=related:kXTXGHu94QYJ:scholar.google.com/&scioq=effect+of+%22monetary+policy%22+on+the+%22gdp+deflator%22&hl=en&as_sdt=0,5"
3,"M Shibamoto","The Estimation of the New Keynesian Phillips Curve in Japan and Its Implication for the Inflation Response to a Monetary Policy Shock",2009,"Research Institute for Economics and Business …","rieb.kobe-u.ac.jp","https://www.rieb.kobe-u.ac.jp/academic/ra/dp/English/dp235.pdf","https://scholar.google.com/scholar?cites=4661955610501506943&as_sdt=2005&sciodt=0,5&hl=en",484,"2023-02-09 16:27:49","PDF","","","",,,,,3,0.21,3,1,14,"… Figures 1 and 2 show the estimated impulse responses of all variables in Xt to a 1% monetary policy shock in the cases of GDP deflator inflation and CPI inflation measures, respectively…","https://www.rieb.kobe-u.ac.jp/academic/ra/dp/English/dp235.pdf","https://scholar.google.com/scholar?q=related:f-eUeu2XskAJ:scholar.google.com/&scioq=effect+of+%22monetary+policy%22+on+the+%22gdp+deflator%22&hl=en&as_sdt=0,5"
3,"H Iiboshi","Measuring the Effects of Monetary Policy: A DSGE-DFM Approach",2012,"","Citeseer","https://citeseerx.ist.psu.edu/document?repid=rep1&type=pdf&doi=bcd0f20cd71a8542174a2687c9766c56bac25c17","https://scholar.google.com/scholar?cites=1757953475946381546&as_sdt=2005&sciodt=0,5&hl=en",485,"2023-02-09 16:27:49","PDF","","","",,,,,3,0.27,3,1,11,"… I propose new method of measuring the effect of monetary policy on a large number of … wage index divided by GDP deflator. (6) Inflation series is a GDP deflator inflation rate (quarterly, …","https://citeseerx.ist.psu.edu/document?repid=rep1&type=pdf&doi=bcd0f20cd71a8542174a2687c9766c56bac25c17","https://scholar.google.com/scholar?q=related:6oByUV-BZRgJ:scholar.google.com/&scioq=effect+of+%22monetary+policy%22+on+the+%22gdp+deflator%22&hl=en&as_sdt=0,5"
85,"E Castelnuovo, G Pellegrino","Uncertainty-dependent effects of monetary policy shocks: A new-Keynesian interpretation",2018,"Journal of Economic Dynamics and Control","Elsevier","https://www.sciencedirect.com/science/article/pii/S016518891830054X","https://scholar.google.com/scholar?cites=10727880011436050599&as_sdt=2005&sciodt=0,5&hl=en",486,"2023-02-09 16:27:49","","","","",,,,,85,17.00,43,2,5,"… y t − ▵ h for the difference between the growth rate of real GDP per capita and the growth rate of hours worked per capita, which is, the growth rate of productivity, π t is the GDP deflator …","https://www.econstor.eu/bitstream/10419/174944/1/cesifo1_wp6821.pdf","https://scholar.google.com/scholar?q=related:p8ioGggW4ZQJ:scholar.google.com/&scioq=effect+of+%22monetary+policy%22+on+the+%22gdp+deflator%22&hl=en&as_sdt=0,5"
0,"P Dörr, P Dörr","Empirical Evidence",2018,"The Impact of Monetary Policy on Economic Inequality","Springer","https://link.springer.com/chapter/10.1007/978-3-658-24835-2_6","",487,"2023-02-09 16:27:49","","10.1007/978-3-658-24835-2_6","","",,,,,0,0.00,0,2,5,"… Nonetheless, actual monetary policy only influences the inflation rate indirectly via the short … on the GDP deflator and the CPI in my analysis, but another monetary policy variable should …","","https://scholar.google.com/scholar?q=related:9QKPbwl9zJEJ:scholar.google.com/&scioq=effect+of+%22monetary+policy%22+on+the+%22gdp+deflator%22&hl=en&as_sdt=0,5"
48,"RJ Gordon","Monetary Policy in the Age of Information Technology",1999,"","Institute for Monetary and Economic …","","https://scholar.google.com/scholar?cites=8368372360370679649&as_sdt=2005&sciodt=0,5&hl=en",488,"2023-02-09 16:27:49","CITATION","","","",,,,,48,2.00,48,1,24,"","","https://scholar.google.com/scholar?q=related:YW8XAFNuInQJ:scholar.google.com/&scioq=effect+of+%22monetary+policy%22+on+the+%22gdp+deflator%22&hl=en&as_sdt=0,5"
207,"N Batini, E Nelson","The lag from monetary policy actions to inflation: Friedman revisited",2001,"International Finance","Wiley Online Library","https://onlinelibrary.wiley.com/doi/abs/10.1111/1468-2362.00079","https://scholar.google.com/scholar?cites=10072123645299664670&as_sdt=2005&sciodt=0,5&hl=en",489,"2023-02-09 16:27:49","","10.1111/1468-2362.00079","","",,,,,207,9.41,104,2,22,"… They find that the F-statistic for excluding M2 growth in an equation for GDP deflator inflation is not significant for 1960–90, and is particularly low and insignificant for samples beginning …","https://www.econstor.eu/bitstream/10419/84685/1/extmpcpaper0006.pdf","https://scholar.google.com/scholar?q=related:HifmSxdfx4sJ:scholar.google.com/&scioq=effect+of+%22monetary+policy%22+on+the+%22gdp+deflator%22&hl=en&as_sdt=0,5"
9,"O Bayar","Temporal aggregation and estimated monetary policy rules",2014,"The BE Journal of Macroeconomics","degruyter.com","https://www.degruyter.com/document/doi/10.1515/bejm-2013-0124/html","https://scholar.google.com/scholar?cites=12708356357322918093&as_sdt=2005&sciodt=0,5&hl=en",490,"2023-02-09 16:27:49","","10.1515/bejm-2013-0124","","",,,,,9,1.00,9,1,9,"… In this table, I use baseline indicators: GDP deflator inflation and CBO output gap. Main result appears robust to a change in the forecast horizon; smoothing parameter is biased upward …","","https://scholar.google.com/scholar?q=related:zUhPdcYmXbAJ:scholar.google.com/&scioq=effect+of+%22monetary+policy%22+on+the+%22gdp+deflator%22&hl=en&as_sdt=0,5"
0,"Y Zhao","Equity Premium and the Monetary Policy",2020,"","theses.ubn.ru.nl","https://theses.ubn.ru.nl/handle/123456789/10091","",491,"2023-02-09 16:27:49","","","","",,,,,0,0.00,0,1,3,"… Popular methods used to measure the inflation rate are the Consumer Price Index (CPI), and the GDP deflator, etc. The measurement of the inflation rate has a significant …","https://theses.ubn.ru.nl/bitstream/handle/123456789/10091/MTHEC%20RU%20Yixuan%20Zhao%20s1041060%20-%20Master's%20Thesis.pdf?sequence=1","https://scholar.google.com/scholar?q=related:m9s7GMFOosIJ:scholar.google.com/&scioq=effect+of+%22monetary+policy%22+on+the+%22gdp+deflator%22&hl=en&as_sdt=0,5"
169,"T Davig, T Doh","Monetary policy regime shifts and inflation persistence",2014,"Review of Economics and Statistics","direct.mit.edu","https://direct.mit.edu/rest/article-abstract/96/5/862/58189","https://scholar.google.com/scholar?cites=621689412902081579&as_sdt=2005&sciodt=0,5&hl=en",492,"2023-02-09 16:27:49","","","","",,,,,169,18.78,85,2,9,"… plot of US inflation, as measured by the GDP deflator, is given in figure 1. Constructing the likelihood for the MSNK model requires integrating out latent variables, including the history of …","https://www.researchgate.net/profile/Taeyoung-Doh/publication/23970089_Monetary_Policy_Regime_Shifts_and_Inflation_Persistence/links/5a023d944585155c96cc9b02/Monetary-Policy-Regime-Shifts-and-Inflation-Persistence.pdf","https://scholar.google.com/scholar?q=related:K1SmKDqvoAgJ:scholar.google.com/&scioq=effect+of+%22monetary+policy%22+on+the+%22gdp+deflator%22&hl=en&as_sdt=0,5"
66,"D Johnson","The credibility of monetary policy: international evidence based on surveys of expected inflation",1998,"Price Stability, Inflation Targets, and Monetary Policy","bankofcanada.ca","https://www.bankofcanada.ca/wp-content/uploads/2010/07/cn97-20.pdf","https://scholar.google.com/scholar?cites=9483118814498747589&as_sdt=2005&sciodt=0,5&hl=en",493,"2023-02-09 16:27:49","PDF","","","",,,,,66,2.64,66,1,25,"… Actual inflation for both the CPI and the GDP deflator is measured with revised data (this paper provides a short data appendix with the details), thus forecast errors are constructed …","https://www.bankofcanada.ca/wp-content/uploads/2010/07/cn97-20.pdf","https://scholar.google.com/scholar?q=related:xXQFbVHOmoMJ:scholar.google.com/&scioq=effect+of+%22monetary+policy%22+on+the+%22gdp+deflator%22&hl=en&as_sdt=0,5"
15,"S Kim","Monetary policy rules and business cycles",2003,"Scandinavian Journal of Economics","Wiley Online Library","https://onlinelibrary.wiley.com/doi/abs/10.1111/1467-9442.t01-1-00006","https://scholar.google.com/scholar?cites=17017497129521033808&as_sdt=2005&sciodt=0,5&hl=en",494,"2023-02-09 16:27:49","","10.1111/1467-9442.t01-1-00006","","",,,,,15,0.75,15,1,20,"… the detrended GDP and the GDP deflator inflation are contemporaneously exogenous to the … monetary policy shocks. The interest rate equation is regarded as the monetary policy rule. …","","https://scholar.google.com/scholar?q=related:ULJUC3pLKuwJ:scholar.google.com/&scioq=effect+of+%22monetary+policy%22+on+the+%22gdp+deflator%22&hl=en&as_sdt=0,5"
8,"C André, P Caraiani, AC Călin, R Gupta","Can monetary policy lean against housing bubbles?",2022,"Economic Modelling","Elsevier","https://www.sciencedirect.com/science/article/pii/S0264999322000475","https://scholar.google.com/scholar?cites=4010644464339511710&as_sdt=2005&sciodt=0,5&hl=en",495,"2023-02-09 16:27:49","","","","",,,,,8,8.00,2,4,1,"… This study also investigated the effects of monetary policy … , real housing prices were obtained by using the GDP deflator. … case, real rents were obtained by using the GDP deflator. …","https://repository.up.ac.za/bitstream/handle/2263/86785/Andre_Can_2022.pdf?sequence=1","https://scholar.google.com/scholar?q=related:nulXGeSrqDcJ:scholar.google.com/&scioq=effect+of+%22monetary+policy%22+on+the+%22gdp+deflator%22&hl=en&as_sdt=0,5"
6,"M Brownbridge","Credit Supply, Monetary Policy and Structural Adjustment in Ghana",1995,"African review of Money Finance and banking","JSTOR","https://www.jstor.org/stable/23027502","https://scholar.google.com/scholar?cites=527463075173407090&as_sdt=2005&sciodt=0,5&hl=en",496,"2023-02-09 16:27:49","","","","",,,,,6,0.21,6,1,28,"… The real lending rate for GDP is derived by deflating the nominal lending rate as defined above by the annual change in the GDP deflator. The real lending rate for the manufacturing …","","https://scholar.google.com/scholar?q=related:cpnYS9_sUQcJ:scholar.google.com/&scioq=effect+of+%22monetary+policy%22+on+the+%22gdp+deflator%22&hl=en&as_sdt=0,5"
141,"GMB Tootell","Globalization and US inflation",2020,"Handbook of Monetary Policy","taylorfrancis.com","https://www.taylorfrancis.com/chapters/edit/10.4324/9780429270949-43/globalization-inflation-geoffrey-tootell","https://scholar.google.com/scholar?cites=2752583963179749681&as_sdt=2005&sciodt=0,5&hl=en",497,"2023-02-09 16:27:49","","10.4324/9780429270949-43","","",,,,,141,47.00,141,1,3,"… this direct effect makes the CPI more likely than the GDP deflator to exhibit any effects from … For the preferred specification of the chain GDP deflator, the total CPI, core PPI, and the …","https://www.bostonfed.org/-/media/Documents/neer/neer498b.pdf","https://scholar.google.com/scholar?q=related:MRHE24ckMyYJ:scholar.google.com/&scioq=effect+of+%22monetary+policy%22+on+the+%22gdp+deflator%22&hl=en&as_sdt=0,5"
83,"JP Byrne, EP Davis","Permanent and temporary inflation uncertainty and investment in the United States",2004,"Economics Letters","Elsevier","https://www.sciencedirect.com/science/article/pii/S0165176504001909","https://scholar.google.com/scholar?cites=15968326875067016440&as_sdt=2005&sciodt=0,5&hl=en",498,"2023-02-09 16:27:49","","","","",,,,,83,4.37,42,2,19,"… effect, temporary uncertainty is more important for investment. This study has implications for monetary policy … as the log first difference of the GDP deflator, suggest μ 4 is insignificantly …","http://www.ephilipdavis.com/permanent%20and%20temp.pdf","https://scholar.google.com/scholar?q=related:-GSxZbDkmt0J:scholar.google.com/&scioq=effect+of+%22monetary+policy%22+on+the+%22gdp+deflator%22&hl=en&as_sdt=0,5"
6,"V Gabriel, P Levine, C Spencer, ...","On the (ir) relevance of direct supply-side effects of monetary policy",2008,"Discussion Papers in …","repec.som.surrey.ac.uk","https://repec.som.surrey.ac.uk/2008/DP04-08.pdf","https://scholar.google.com/scholar?cites=15808384154021093297&as_sdt=2005&sciodt=0,5&hl=en",499,"2023-02-09 16:27:49","PDF","","","",,,,,6,0.40,2,4,15,"… The inflation rate is measured as GDP deflator inflation, marginal cost is proxied by non-farm business sector real unit labour costs and interest is the 3-month T-bill rate. Instruments …","https://repec.som.surrey.ac.uk/2008/DP04-08.pdf","https://scholar.google.com/scholar?q=related:sV9XtaGpYtsJ:scholar.google.com/&scioq=effect+of+%22monetary+policy%22+on+the+%22gdp+deflator%22&hl=en&as_sdt=0,5"
107,"J Atta-Mensah, A Dib","Bank lending, credit shocks, and the transmission of Canadian monetary policy",2008,"International Review of Economics &Finance","Elsevier","https://www.sciencedirect.com/science/article/pii/S105905600600061X","https://scholar.google.com/scholar?cites=4805688360009018745&as_sdt=2005&sciodt=0,5&hl=en",500,"2023-02-09 16:27:49","","","","",,,,,107,7.13,54,2,15,"… The monetary aggregate used is M1, which we deflated by the GDP deflator. Our estimated equation is:(A.1) log ( m c ⁢ t / c t ) = − 2.1635 ( 0.043 ) − 0.0223 ( 0.011 ) log ( r t ) + u b ⁢ t ; …","https://www.bankofcanada.ca/wp-content/uploads/2010/02/wp03-9.pdf","https://scholar.google.com/scholar?q=related:eS2RDxo8sUIJ:scholar.google.com/&scioq=effect+of+%22monetary+policy%22+on+the+%22gdp+deflator%22&hl=en&as_sdt=0,5"
7,"JP FITOUSSI","MONETARY POLICY AND THE MACROECONOMICS OF µSOFTP GROWTH",2001,"","www-ceel.economia.unitn.it","http://www-ceel.economia.unitn.it/events/monetary/fitoussi9.pdf","https://scholar.google.com/scholar?cites=9334940813710949315&as_sdt=2005&sciodt=0,5&hl=en",501,"2023-02-09 16:27:49","PDF","","","",,,,,7,0.32,7,1,22,"… a severe move in monetary policy? Between 1986 and 1990, the real short term interest rate had increased by 280 basis points for the E15, when using the GDP deflator to calculate the …","http://www-ceel.economia.unitn.it/events/monetary/fitoussi9.pdf","https://scholar.google.com/scholar?q=related:w3uJIDZfjIEJ:scholar.google.com/&scioq=effect+of+%22monetary+policy%22+on+the+%22gdp+deflator%22&hl=en&as_sdt=0,5"
31,"P Stalder","Free migration between the EU and Switzerland: impacts on the Swiss economy and implications for monetary policy",2010,"Swiss Journal of Economics and Statistics","sjes.springeropen.com","https://sjes.springeropen.com/track/pdf/10.1007/BF03399338.pdf","https://scholar.google.com/scholar?cites=5845115549102002472&as_sdt=2005&sciodt=0,5&hl=en",502,"2023-02-09 16:27:49","PDF","10.1007/BF03399338","","",,,,,31,2.38,31,1,13,"… It turns out that nominal wages respond to CPI inflation and labor market tension in the short run, whereas they are co-integrated with the GDP deflator and labor productivity in the long …","https://sjes.springeropen.com/track/pdf/10.1007/BF03399338.pdf","https://scholar.google.com/scholar?q=related:KFFWh58FHlEJ:scholar.google.com/&scioq=effect+of+%22monetary+policy%22+on+the+%22gdp+deflator%22&hl=en&as_sdt=0,5"
31,"J Baxa","What the data say about the effects of fiscal policy in the Czech Republic",2010,"Mathematical Methods in Economics","researchgate.net","https://www.researchgate.net/profile/Jaromir-Baxa/publication/310059532_What_the_Data_Say_about_the_Effects_of_Fiscal_Policy_in_the_Czech_Republic/links/58286deb08ae254c50860c0f/What-the-Data-Say-about-the-Effects-of-Fiscal-Policy-in-the-Czech-Republic.pdf","https://scholar.google.com/scholar?cites=1670065325590693606&as_sdt=2005&sciodt=0,5&hl=en",503,"2023-02-09 16:27:49","PDF","","","",,,,,31,2.38,31,1,13,"… with existing studies on the effects of monetary policy. … of nominal GDP deflated by the GDP deflator related to the year … These time series were deflated by the GDP deflator, too. For the …","https://www.researchgate.net/profile/Jaromir-Baxa/publication/310059532_What_the_Data_Say_about_the_Effects_of_Fiscal_Policy_in_the_Czech_Republic/links/58286deb08ae254c50860c0f/What-the-Data-Say-about-the-Effects-of-Fiscal-Policy-in-the-Czech-Republic.pdf","https://scholar.google.com/scholar?q=related:5saHs5BDLRcJ:scholar.google.com/&scioq=effect+of+%22monetary+policy%22+on+the+%22gdp+deflator%22&hl=en&as_sdt=0,5"
106,"BM Friedman","The rise and fall of money growth targets as guidelines for US monetary policy",1997,"","Springer","https://link.springer.com/chapter/10.1007/978-1-349-25382-1_6","https://scholar.google.com/scholar?cites=277484233461947430&as_sdt=2005&sciodt=0,5&hl=en",504,"2023-02-09 16:27:49","BOOK","10.1007/978-1-349-25382-1_6","","",,,,,106,4.08,106,1,26,"… Does it matter whether the authorities care about the CPI or the GDP deflator? And does it matter whether the authorities care about nominal spending, rather than its two components? …","https://www.nber.org/system/files/working_papers/w5465/w5465.pdf","https://scholar.google.com/scholar?q=related:JlxFrnDS2QMJ:scholar.google.com/&scioq=effect+of+%22monetary+policy%22+on+the+%22gdp+deflator%22&hl=en&as_sdt=0,5"
117,"BT McCallum","Japanese monetary policy, 1991-2001",2003,"FRB Richmond Economic Quarterly","papers.ssrn.com","https://papers.ssrn.com/sol3/papers.cfm?abstract_id=2184941","https://scholar.google.com/scholar?cites=8989070077347505914&as_sdt=2005&sciodt=0,5&hl=en",505,"2023-02-09 16:27:49","","","","",,,,,117,5.85,117,1,20,"… where R is the call rate, pa t is the average inflation rate (GDP deflator) over the previous four quarters, y is real GDP and y is its potential value.A chart contrasting Taylor-rule …","https://fraser.stlouisfed.org/files/docs/publications/frbrichreview/rev_frbrich200301.pdf","https://scholar.google.com/scholar?q=related:-iZk9ZuXv3wJ:scholar.google.com/&scioq=effect+of+%22monetary+policy%22+on+the+%22gdp+deflator%22&hl=en&as_sdt=0,5"
5,"J Galí, L Gambetti","The Effect of Monetary Policy on Asset Price Bubbles: Some Evidence",2013,"Unpublished manuscript","Citeseer","https://citeseerx.ist.psu.edu/document?repid=rep1&type=pdf&doi=e198a1012a961d5e079a370c245ffaa1ffb42451","https://scholar.google.com/scholar?cites=14607366893496999393&as_sdt=2005&sciodt=0,5&hl=en",506,"2023-02-09 16:27:49","PDF","","","",,,,,5,0.50,3,2,10,"… use quarterly US time series for GDP and its deflator, the federal funds rate, and the S&P500 stock price index and the corresponding dividend series (both deflated by the GDP deflator)…","https://citeseerx.ist.psu.edu/document?repid=rep1&type=pdf&doi=e198a1012a961d5e079a370c245ffaa1ffb42451","https://scholar.google.com/scholar?q=related:4Z2w5svKt8oJ:scholar.google.com/&scioq=effect+of+%22monetary+policy%22+on+the+%22gdp+deflator%22&hl=en&as_sdt=0,5"
58,"RB Barsky, L Kilian","A Monetary Explanation of the Great Stagflation of the 1970s",2000,"","nber.org","https://www.nber.org/papers/w7547","https://scholar.google.com/scholar?cites=4093373952823755825&as_sdt=2005&sciodt=0,5&hl=en",507,"2023-02-09 16:27:49","","","","",,,,,58,2.52,29,2,23,"… evidence of an important effect of oil price shocks on the GDP deflator, whereas the inflation data appear fully consistent with explanations based on goand-stop monetary policy. …","https://www.nber.org/system/files/working_papers/w7547/w7547.pdf","https://scholar.google.com/scholar?q=related:MYTlJuyVzjgJ:scholar.google.com/&scioq=effect+of+%22monetary+policy%22+on+the+%22gdp+deflator%22&hl=en&as_sdt=0,5"
41,"M Hasanov, T Omay","Monetary policy rules in practice: Re-examining the case of Turkey",2008,"Physica A: Statistical Mechanics and its Applications","Elsevier","https://www.sciencedirect.com/science/article/pii/S0378437108002549","https://scholar.google.com/scholar?cites=8895505285046479744&as_sdt=2005&sciodt=0,5&hl=en",508,"2023-02-09 16:27:49","","","","",,,,,41,2.73,21,2,15,"… monetary policy has vital economic consequences, it is important to analyse covert objectives of central banks. In addition to broadening our knowledge of monetary policy … GDP deflator…","","https://scholar.google.com/scholar?q=related:gCvOJO0uc3sJ:scholar.google.com/&scioq=effect+of+%22monetary+policy%22+on+the+%22gdp+deflator%22&hl=en&as_sdt=0,5"
14,"S Younus","Relative effectiveness of Monetary and Fiscal policies on output growth in Bangladesh: A Co integration and Vector Error Correction approach",2014,"International Research Conferences","cbsl.gov.lk","https://www.cbsl.gov.lk/sites/default/files/Monetary_n_Fiscal_BB_CBL_full.pdf","https://scholar.google.com/scholar?cites=11265210326571834787&as_sdt=2005&sciodt=0,5&hl=en",509,"2023-02-09 16:27:49","PDF","","","",,,,,14,1.56,14,1,9,"… , to investigate whether the monetary policy is relatively more … government expenditure is GDP deflator adjusted general … Real Money (m): Real money is GDP deflator adjusted broad …","https://www.cbsl.gov.lk/sites/default/files/Monetary_n_Fiscal_BB_CBL_full.pdf","https://scholar.google.com/scholar?q=related:o11gOxsRVpwJ:scholar.google.com/&scioq=effect+of+%22monetary+policy%22+on+the+%22gdp+deflator%22&hl=en&as_sdt=0,5"
826,"K Aoki, J Proudman, G Vlieghe","House prices, consumption, and monetary policy: a financial accelerator approach",2004,"Journal of financial intermediation","Elsevier","https://www.sciencedirect.com/science/article/pii/S1042957304000282","https://scholar.google.com/scholar?cites=7047966790894437270&as_sdt=2005&sciodt=0,5&hl=en",510,"2023-02-09 16:27:49","","","","",,,,,826,43.47,275,3,19,"… effect of monetary policy shocks on housing investment, house prices and consumption. We also consider the effect … : DETR house price index deflated by the GDP deflator (YBGB). Real …","https://citeseerx.ist.psu.edu/document?repid=rep1&type=pdf&doi=959c59a652fdeed9c524ea62f95f2c80f001747e","https://scholar.google.com/scholar?q=related:lkMDYHRoz2EJ:scholar.google.com/&scioq=effect+of+%22monetary+policy%22+on+the+%22gdp+deflator%22&hl=en&as_sdt=0,5"
3,"C Morana","The price stability oriented monetary policy of the ECB: an assessment",2006,"Applied Economics","Taylor &Francis","https://www.tandfonline.com/doi/abs/10.1080/00036840500427312","https://scholar.google.com/scholar?cites=12020156296979322811&as_sdt=2005&sciodt=0,5&hl=en",511,"2023-02-09 16:27:49","","10.1080/00036840500427312","","",,,,,3,0.18,3,1,17,"… , while the inflation cycle points to excess inflation relatively to trend due to transitory shocks, trend inflation, as measured by the annualized permanent component in the GDP deflator …","https://www.tandfonline.com/doi/pdf/10.1080/00036840500427312?needAccess=true&role=button","https://scholar.google.com/scholar?q=related:u5cgcncs0KYJ:scholar.google.com/&scioq=effect+of+%22monetary+policy%22+on+the+%22gdp+deflator%22&hl=en&as_sdt=0,5"
2422,"A Mountford, H Uhlig","What are the effects of fiscal policy shocks?",2009,"Journal of applied econometrics","Wiley Online Library","https://onlinelibrary.wiley.com/doi/abs/10.1002/jae.1079","https://scholar.google.com/scholar?cites=7964038716944192417&as_sdt=2005&sciodt=0,5&hl=en",512,"2023-02-09 16:27:49","","10.1002/jae.1079","","",,,,,2422,173.00,1211,2,14,"… While there is agreement that a monetary policy shock … cycle shock and a monetary policy shock and require that a … for crude materials and the GDP deflator. The VAR system consists of …","https://www.nber.org/system/files/working_papers/w14551/w14551.pdf","https://scholar.google.com/scholar?q=related:oZPqjATzhW4J:scholar.google.com/&scioq=effect+of+%22monetary+policy%22+on+the+%22gdp+deflator%22&hl=en&as_sdt=0,5"
71,"M Darracq Paries, RA De Santis","A non-standard monetary policy shock: the ECB's 3-year LTROs and the shift in credit supply",2013,"","papers.ssrn.com","https://papers.ssrn.com/sol3/papers.cfm?abstract_id=2204282","https://scholar.google.com/scholar?cites=11044190129835032001&as_sdt=2005&sciodt=0,5&hl=en",513,"2023-02-09 16:27:49","","","","",,,,,71,7.10,36,2,10,"… The associated effects on price dynamics reached 0.3 percentage points of annual GDP deflator inflation. Turning to credit variables, up to 3 percentage points of annual loan growth …","https://www.econstor.eu/bitstream/10419/153941/1/ecbwp1508.pdf","https://scholar.google.com/scholar?q=related:wT2xkGjYRJkJ:scholar.google.com/&scioq=effect+of+%22monetary+policy%22+on+the+%22gdp+deflator%22&hl=en&as_sdt=0,5"
28,"J Di Giovanni, J McCrary, ...","Following Germany's lead: Using International Monetary Linkages to estimate the effect of Monetary Policy on the economy",2009,"The Review of Economics …","direct.mit.edu","https://direct.mit.edu/rest/article-abstract/91/2/315/57769","https://scholar.google.com/scholar?cites=14546117337003972839&as_sdt=2005&sciodt=0,5&hl=en",514,"2023-02-09 16:27:49","","","","",,,,,28,2.00,9,3,14,"… (IV) estimates of the effect of monetary policy on real output for … confirm powerful real effects of monetary policy. Our esti… looking component of European monetary policy in the pre-EMU …","https://citeseerx.ist.psu.edu/document?repid=rep1&type=pdf&doi=e065300d42fcb97279caccb4e3f0746ecc2623c0","https://scholar.google.com/scholar?q=related:59hFPaYw3skJ:scholar.google.com/&scioq=effect+of+%22monetary+policy%22+on+the+%22gdp+deflator%22&hl=en&as_sdt=0,5"
