Cites,Authors,Title,Year,Source,Publisher,ArticleURL,CitesURL,GSRank,QueryDate,Type,DOI,ISSN,CitationURL,Volume,Issue,StartPage,EndPage,ECC,CitesPerYear,CitesPerAuthor,AuthorCount,Age,Abstract,FullTextURL,RelatedURL
17,"KD Roskelley","Augmenting the Taylor rule: Monetary policy and the bond market",2016,"Economics Letters","Elsevier","https://www.sciencedirect.com/science/article/pii/S0165176516301483","https://scholar.google.com/scholar?cites=5599809510879633743&as_sdt=2005&sciodt=0,5&hl=en",262,"2023-02-09 16:27:49","","","","",,,,,17,2.43,17,1,7,"… monetary policy. To estimate the Taylor rule, I obtain quarterly observations on the average Fed funds rate and chain-weighted GDP deflator … log difference in the GDP deflator at time t …","https://www.researchgate.net/profile/Kenneth-Roskelley/publication/301917295_Augmenting_the_Taylor_rule_Monetary_policy_and_the_bond_market/links/5739e16008ae9ace840db5bc/Augmenting-the-Taylor-rule-Monetary-policy-and-the-bond-market.pdf","https://scholar.google.com/scholar?q=related:T6HVwRSFtk0J:scholar.google.com/&scioq=effect+of+%22monetary+policy%22+on+the+%22gdp+deflator%22&hl=en&as_sdt=0,5"
7,"SB Carpenter, WM Rodgers","The disparate labor market impacts of monetary policy",2005,"Labor History","Taylor &Francis","https://www.tandfonline.com/doi/abs/10.1080/0023656042000329873","https://scholar.google.com/scholar?cites=17297361087250454417&as_sdt=2005&sciodt=0,5&hl=en",263,"2023-02-09 16:27:49","","10.1080/0023656042000329873","","",,,,,7,0.39,4,2,18,"… the recursive ordering that monetary policy innovations are contemporaneously … GDP deflator. Industrial production and the CPI-U are available monthly while GDP and the GDP deflator …","","https://scholar.google.com/scholar?q=related:kVc6dUOSDPAJ:scholar.google.com/&scioq=effect+of+%22monetary+policy%22+on+the+%22gdp+deflator%22&hl=en&as_sdt=0,5"
41,"JY Liu, SM Lin, Y Xia, Y Fan, J Wu","A financial CGE model analysis: Oil price shocks and monetary policy responses in China",2015,"Economic Modelling","Elsevier","https://www.sciencedirect.com/science/article/pii/S0264999315002370","https://scholar.google.com/scholar?cites=3962904534721084087&as_sdt=2005&sciodt=0,5&hl=en",264,"2023-02-09 16:27:49","","","","",,,,,41,5.13,8,5,8,"… effects on economic activities of packages of tightening interest and reserve ratio policy. For each anti-inflation initiative, we aim to find out the monetary policy … The GDP deflator rises by …","https://kd.nsfc.gov.cn/paperDownload/1000015152286.pdf","https://scholar.google.com/scholar?q=related:t7rVjq0Q_zYJ:scholar.google.com/&scioq=effect+of+%22monetary+policy%22+on+the+%22gdp+deflator%22&hl=en&as_sdt=0,5"
50,"J Lindé","Monetary policy shocks and business cycle fluctuations in a small open economy: Sweden 1986-2002",2003,"","econstor.eu","https://www.econstor.eu/handle/10419/82397","https://scholar.google.com/scholar?cites=2272739106887443965&as_sdt=2005&sciodt=0,5&hl=en",265,"2023-02-09 16:27:49","","","","",,,,,50,2.50,50,1,20,"… In this paper, πt is measured with the GDP deflator, but the obtained results are very similar if the CPI is used instead as in Smets and Wouters (2002). Inflation on imported goods is …","https://www.econstor.eu/bitstream/10419/82397/1/wp_153.pdf","https://scholar.google.com/scholar?q=related:_SUqHS1kih8J:scholar.google.com/&scioq=effect+of+%22monetary+policy%22+on+the+%22gdp+deflator%22&hl=en&as_sdt=0,5"
4,"T Raffinot","Interest-Rates-Free Monetary Policy Rule",2017,"","papers.ssrn.com","https://papers.ssrn.com/sol3/papers.cfm?abstract_id=2975944","https://scholar.google.com/scholar?cites=5358524698935407247&as_sdt=2005&sciodt=0,5&hl=en",266,"2023-02-09 16:27:49","","","","",,,,,4,0.67,4,1,6,"… It should be added that the GDP deflator, which reflects prices of all goods and services … However, expectations for the GDP deflator are quite rare (especially in the euro area) and …","https://www.mercatus.org/system/files/mercatus-raffinot-interest-rates-free-v1.pdf","https://scholar.google.com/scholar?q=related:j7IzsNJNXUoJ:scholar.google.com/&scioq=effect+of+%22monetary+policy%22+on+the+%22gdp+deflator%22&hl=en&as_sdt=0,5"
0,"M Clements","Monetary Policy at the US Federal Reserve",2004,"… Federal Funds Rate: A Monetary Policy Model for the …","Springer","https://link.springer.com/chapter/10.1057/9780230509030_3","",267,"2023-02-09 16:27:49","","10.1057/9780230509030_3","","",,,,,0,0.00,0,1,19,"… The PCE price index is typically lower than the CPI and is more closely related to the GDP deflator. The Fed stated that the index more closely reflects changing spending patterns of …","","https://scholar.google.com/scholar?q=related:3R0IQSuyFOsJ:scholar.google.com/&scioq=effect+of+%22monetary+policy%22+on+the+%22gdp+deflator%22&hl=en&as_sdt=0,5"
7,"L Mahadeva, A Muscatelli","National accounts revisions and output gap estimates in a model of monetary policy with data uncertainty",2005,"","econstor.eu","https://www.econstor.eu/handle/10419/84698","https://scholar.google.com/scholar?cites=4514111098177735630&as_sdt=2005&sciodt=0,5&hl=en",268,"2023-02-09 16:27:49","","","","",,,,,7,0.39,4,2,18,"… We assume that GDP deflator inflation deviates from CPI inflation because of two types of errors. First, there are deflator errors which only distort the relationship between deflator …","https://www.econstor.eu/bitstream/10419/84698/1/extmpcpaper0014.pdf","https://scholar.google.com/scholar?q=related:zkuIgyBYpT4J:scholar.google.com/&scioq=effect+of+%22monetary+policy%22+on+the+%22gdp+deflator%22&hl=en&as_sdt=0,5"
204,"FD Fiore, O Tristani","Optimal monetary policy in a model of the credit channel",2013,"The Economic Journal","academic.oup.com","https://academic.oup.com/ej/article-abstract/123/571/906/5080517","https://scholar.google.com/scholar?cites=18175316567801011372&as_sdt=2005&sciodt=0,5&hl=en",269,"2023-02-09 16:27:49","","","","",,,,,204,20.40,102,2,10,"… cost, HP‐filtered output gap, GDP deflator inflation, the Commodity Research Bureau (CRB) … hourly compensation inflation, and four lags of GDP deflator inflation and three‐month T‐bill …","https://www.econstor.eu/bitstream/10419/153477/1/ecbwp1043.pdf","https://scholar.google.com/scholar?q=related:rBwNGB-yO_wJ:scholar.google.com/&scioq=effect+of+%22monetary+policy%22+on+the+%22gdp+deflator%22&hl=en&as_sdt=0,5"
0,"A Civelli, N Zaniboni","The cost channel and the persistence of the inflation response to a monetary policy shock.",2011,"","","","",270,"2023-02-09 16:27:49","CITATION","","","",,,,,0,0.00,0,2,12,"","","https://scholar.google.com/scholar?q=related:OwfSzJM8vKMJ:scholar.google.com/&scioq=effect+of+%22monetary+policy%22+on+the+%22gdp+deflator%22&hl=en&as_sdt=0,5"
208,"L Benati","The “great moderation” in the United Kingdom",2008,"Journal of Money, Credit and Banking","Wiley Online Library","https://onlinelibrary.wiley.com/doi/abs/10.1111/j.1538-4616.2008.00106.x","https://scholar.google.com/scholar?cites=1044534846479848362&as_sdt=2005&sciodt=0,5&hl=en",271,"2023-02-09 16:27:49","","10.1111/j.1538-4616.2008.00106.x","","",,,,,208,13.87,208,1,15,"… VAR with stochastic volatility for GDP deflator inflation, real GDP … collective judgment of the Monetary Policy Committee, while, … , while those of the Monetary Policy Committeé distill the …","https://www.econstor.eu/bitstream/10419/153203/1/ecbwp0769.pdf","https://scholar.google.com/scholar?q=related:qtPyn-jufg4J:scholar.google.com/&scioq=effect+of+%22monetary+policy%22+on+the+%22gdp+deflator%22&hl=en&as_sdt=0,5"
642,"C Baumeister, L Benati","Unconventional monetary policy and the great recession-Estimating the impact of a compression in the yield spread at the zero lower bound",2010,"","papers.ssrn.com","https://papers.ssrn.com/sol3/papers.cfm?abstract_id=1691633","https://scholar.google.com/scholar?cites=15732484916373165836&as_sdt=2005&sciodt=0,5&hl=en",272,"2023-02-09 16:27:49","","","","",,,,,642,49.38,321,2,13,"… Japan, and the United Kingdom, actual GDP deflator inflation together with the time-varying trends … In particular, in Japan, where the GDP deflator has decreased, as of 2009Q4, by 14.3 …","https://www.bankofcanada.ca/wp-content/uploads/2012/07/wp2012-21.pdf","https://scholar.google.com/scholar?q=related:DBedWq0DVdoJ:scholar.google.com/&scioq=effect+of+%22monetary+policy%22+on+the+%22gdp+deflator%22&hl=en&as_sdt=0,5"
1,"O Holtemöller, A Kriwoluzky, B Kwak","Exchange rates and the information channel of monetary policy",2020,"","papers.ssrn.com","https://papers.ssrn.com/sol3/papers.cfm?abstract_id=3720440","https://scholar.google.com/scholar?cites=2582251892975227768&as_sdt=2005&sciodt=0,5&hl=en",273,"2023-02-09 16:27:49","","","","",,,,,1,0.33,0,3,3,"… As a robustness check, we also consider the monthly (interpolated) real gross domestic production (GDP) and GDP deflator instead of industrial production and the consumer price index…","https://www.econstor.eu/bitstream/10419/225081/1/173550341X.pdf","https://scholar.google.com/scholar?q=related:eFNeUWoA1iMJ:scholar.google.com/&scioq=effect+of+%22monetary+policy%22+on+the+%22gdp+deflator%22&hl=en&as_sdt=0,5"
84,"MD Hayford, AG Malliaris","Monetary policy and the US stock market",2004,"Economic Inquiry","Wiley Online Library","https://onlinelibrary.wiley.com/doi/abs/10.1093/ei/cbh068","https://scholar.google.com/scholar?cites=7927768246354076516&as_sdt=2005&sciodt=0,5&hl=en",274,"2023-02-09 16:27:49","","10.1093/ei/cbh068","","",,,,,84,4.42,42,2,19,"… on the positive question of whether monetary policy since 1987 has been influenced by the … revised data for the GDP deflator. The real-time data for the GDP deflator, unemployment, …","http://www.malliaris.me/2004-Monetary%20policy%20and%20the%20US%20stock%20market-Ecoonomic%20Inquiry-MDH%20AGM.pdf","https://scholar.google.com/scholar?q=related:ZGOOiTcXBW4J:scholar.google.com/&scioq=effect+of+%22monetary+policy%22+on+the+%22gdp+deflator%22&hl=en&as_sdt=0,5"
4,"RA De Santis","Heterogeneity, monetary policy and banks' balance sheets: evidence from Euro area countries",2015,"Applied Economics Letters","Taylor &Francis","https://www.tandfonline.com/doi/abs/10.1080/13504851.2014.957435","https://scholar.google.com/scholar?cites=18390756777196872196&as_sdt=2005&sciodt=0,5&hl=en",275,"2023-02-09 16:27:49","","10.1080/13504851.2014.957435","","",,,,,4,0.50,4,1,8,"… Prior to estimation, the interest change is orthogonalized by taking the residuals on a regression of interest rate change on Euro area real GDP growth, Euro area GDP deflator inflation, …","","https://scholar.google.com/scholar?q=related:BGJtt9kXOf8J:scholar.google.com/&scioq=effect+of+%22monetary+policy%22+on+the+%22gdp+deflator%22&hl=en&as_sdt=0,5"
1,"P Hürtgen, J Cloyne","The macroeconomic effects of monetary policy: A new measure for the United Kingdom",2014,"","econstor.eu","https://www.econstor.eu/handle/10419/100304","https://scholar.google.com/scholar?cites=7513991393504689631&as_sdt=2005&sciodt=0,5&hl=en",276,"2023-02-09 16:27:49","","","","",,,,,1,0.11,1,2,9,"This paper estimates the effects of monetary policy on the UK … a new measure of monetary policy innovations for the UK … for interpreting estimates of the effect of monetary policy. We can …","https://www.econstor.eu/bitstream/10419/100304/1/VfS_2014_pid_401.pdf","https://scholar.google.com/scholar?q=related:330wj1wPR2gJ:scholar.google.com/&scioq=effect+of+%22monetary+policy%22+on+the+%22gdp+deflator%22&hl=en&as_sdt=0,5"
16,"KS Kim, WD McMillin","Estimating the effects of monetary policy shocks: does lag structure matter?",2003,"Applied Economics","Taylor &Francis","https://www.tandfonline.com/doi/abs/10.1080/0003684032000090663","https://scholar.google.com/scholar?cites=637274478269227150&as_sdt=2005&sciodt=0,5&hl=en",277,"2023-02-09 16:27:49","","10.1080/0003684032000090663","","",,,,,16,0.80,8,2,20,"… for estimating the effects of monetary policy shocks in a VAR. … are employed to identify monetary policy shocks. Monte Carlo … of (log of commodity prices – log of gdp deflator). DFFR: first …","https://core.ac.uk/download/pdf/21748674.pdf","https://scholar.google.com/scholar?q=related:juCo9cIN2AgJ:scholar.google.com/&scioq=effect+of+%22monetary+policy%22+on+the+%22gdp+deflator%22&hl=en&as_sdt=0,5"
10,"P Phiromswad","Measuring monetary policy with empirically grounded restrictions: An application to Thailand",2015,"Journal of Asian Economics","Elsevier","https://www.sciencedirect.com/science/article/pii/S1049007815000378","https://scholar.google.com/scholar?cites=1748522423152153627&as_sdt=2005&sciodt=0,5&hl=en",278,"2023-02-09 16:27:49","","","","",,,,,10,1.25,10,1,8,"… This paper studies the effect of monetary policy in Thailand … well as the short term effect of monetary policy. I find that several … The GDP and GDP deflator data are from the NESDB. The …","","https://scholar.google.com/scholar?q=related:GxTKOeH_QxgJ:scholar.google.com/&scioq=effect+of+%22monetary+policy%22+on+the+%22gdp+deflator%22&hl=en&as_sdt=0,5"
34,"K Hussain","Monetary policy channels of Pakistan and their impact on real GDP and inflation",2009,"CID Research Fellow and Graduate Student Working …","dash.harvard.edu","https://dash.harvard.edu/handle/1/37366527","https://scholar.google.com/scholar?cites=16173621107737424089&as_sdt=2005&sciodt=0,5&hl=en",279,"2023-02-09 16:27:49","","","","",,,,,34,2.43,34,1,14,"… Real GDP at 1999 base year, we calculate the GDP deflator42. This is done by using the data … then dividing the original GDP series with the GDP deflator of the year 1999. The data for …","https://dash.harvard.edu/bitstream/handle/1/37366527/041.pdf?sequence=1","https://scholar.google.com/scholar?q=related:2fByurQ-dOAJ:scholar.google.com/&scioq=effect+of+%22monetary+policy%22+on+the+%22gdp+deflator%22&hl=en&as_sdt=0,5"
62,"HC Bjørnland, DH Jacobsen","House prices and stock prices: Different roles in the US monetary transmission mechanism",2013,"The Scandinavian Journal of …","Wiley Online Library","https://onlinelibrary.wiley.com/doi/abs/10.1111/sjoe.12031","https://scholar.google.com/scholar?cites=5043928754211191047&as_sdt=2005&sciodt=0,5&hl=en",280,"2023-02-09 16:27:49","","10.1111/sjoe.12031","","",,,,,62,6.20,31,2,10,"… Note that we have not restricted the long-term effects of monetary-policy shocks on house … In particular, the VAR model comprises the annual change of the log of the GDP deflator ( urn:x…","http://home.bi.no/a0310125/BH_SJE_2013.pdf","https://scholar.google.com/scholar?q=related:B_kiY3qi_0UJ:scholar.google.com/&scioq=effect+of+%22monetary+policy%22+on+the+%22gdp+deflator%22&hl=en&as_sdt=0,5"
0,"NM Kilfoil","The effects of oil price shocks on US inflation",2006,"","ir.library.oregonstate.edu","https://ir.library.oregonstate.edu/dspace/handle/1957/2330","",281,"2023-02-09 16:27:49","","","","",,,,,0,0.00,0,1,17,"… in monetary policy will be discussed later in this paper. It has been generally accepted that monetary policy … the more ambiguous effects that an oil price shock has on the GDP deflator. …","https://ir.library.oregonstate.edu/downloads/qr46r2761","https://scholar.google.com/scholar?q=related:a9IMbUqj2HEJ:scholar.google.com/&scioq=effect+of+%22monetary+policy%22+on+the+%22gdp+deflator%22&hl=en&as_sdt=0,5"
4,"PA Memon, NH Ghumro","Impact of monetary and fiscal policies on Pakistan's economy using vector autoregressive model",2014,"International SAMANM Journal of …","researchgate.net","https://www.researchgate.net/profile/Niaz-Ghumro/publication/290036656_Impact_of_Monetary_and_Fiscal_Policies_on_Pakistan's_Economy_using_Vector_Autoregressive_Model/links/56948e0708ae3ad8e33b786b/Impact-of-Monetary-and-Fiscal-Policies-on-Pakistans-Economy-using-Vector-Autoregressive-Model.pdf","https://scholar.google.com/scholar?cites=16945063566613247431&as_sdt=2005&sciodt=0,5&hl=en",282,"2023-02-09 16:27:49","PDF","","","",,,,,4,0.44,2,2,9,"… effects on the economy. For policy reaction, we have found countercyclical response of monetary policy … We have divided nominal GDP by constant price GDP to get GDP deflator – an …","https://www.researchgate.net/profile/Niaz-Ghumro/publication/290036656_Impact_of_Monetary_and_Fiscal_Policies_on_Pakistan's_Economy_using_Vector_Autoregressive_Model/links/56948e0708ae3ad8e33b786b/Impact-of-Monetary-and-Fiscal-Policies-on-Pakistans-Economy-using-Vector-Autoregressive-Model.pdf","https://scholar.google.com/scholar?q=related:x3Vl-Ij1KOsJ:scholar.google.com/&scioq=effect+of+%22monetary+policy%22+on+the+%22gdp+deflator%22&hl=en&as_sdt=0,5"
52,"D Senbet","The relative impact of fiscal versus monetary actions on output: A vector autoregressive (VAR) approach",2011,"Business and Economics Journal","go.gale.com","https://go.gale.com/ps/i.do?id=GALE%7CA335189009&sid=googleScholar&v=2.1&it=r&linkaccess=abs&issn=21516219&p=AONE&sw=w","https://scholar.google.com/scholar?cites=1784179581158991515&as_sdt=2005&sciodt=0,5&hl=en",283,"2023-02-09 16:27:49","","","","",,,,,52,4.33,52,1,12,"… We obtain the real GDP after dividing the nominal GDP by the GDP deflator. … is used as a measure of monetary policy, we have a one-way causality from monetary policy to real output in …","","https://scholar.google.com/scholar?q=related:m6Z8RuCtwhgJ:scholar.google.com/&scioq=effect+of+%22monetary+policy%22+on+the+%22gdp+deflator%22&hl=en&as_sdt=0,5"
138,"R Gupta, M Jurgilas, A Kabundi","The effect of monetary policy on real house price growth in South Africa: A factor-augmented vector autoregression (FAVAR) approach",2010,"Economic modelling","Elsevier","https://www.sciencedirect.com/science/article/pii/S0264999309001680","https://scholar.google.com/scholar?cites=4098562658282644232&as_sdt=2005&sciodt=0,5&hl=en",284,"2023-02-09 16:27:49","","","","",,,,,138,10.62,46,3,13,"… This paper assesses the impact of monetary policy on real house price growth in South … , house price inflation responds negatively to monetary policy shock, but the responses are …","https://repository.up.ac.za/bitstream/handle/2263/13912/Gupta_Effect%282010%29.pdf?sequence=1","https://scholar.google.com/scholar?q=related:CCOeyAUF4TgJ:scholar.google.com/&scioq=effect+of+%22monetary+policy%22+on+the+%22gdp+deflator%22&hl=en&as_sdt=0,5"
10,"SB Aruoba, T Drechsel","Identifying monetary policy shocks: A natural language approach",2022,"","papers.ssrn.com","https://papers.ssrn.com/sol3/papers.cfm?abstract_id=4069942","https://scholar.google.com/scholar?cites=9704633295343089236&as_sdt=2005&sciodt=0,5&hl=en",285,"2023-02-09 16:27:49","","","","",,,,,10,10.00,5,2,1,"… monetary policy shocks at hand, we study impulse response functions (IRFs) of macro variables to monetary policy … yield, the log of the S&P500, log real GDP, the log GDP deflator, and …","http://econweb.umd.edu/~drechsel/papers/Aruoba_Drechsel.pdf","https://scholar.google.com/scholar?q=related:VHZalJDIrYYJ:scholar.google.com/&scioq=effect+of+%22monetary+policy%22+on+the+%22gdp+deflator%22&hl=en&as_sdt=0,5"
87,"M Inui, N Sudou, T Yamada","The effects of monetary policy shocks on inequality in Japan",2017,"","papers.ssrn.com","https://papers.ssrn.com/sol3/papers.cfm?abstract_id=2982887","https://scholar.google.com/scholar?cites=17559984261914561436&as_sdt=2005&sciodt=0,5&hl=en",286,"2023-02-09 16:27:49","","","","",,,,,87,14.50,29,3,6,"… Section 5 explores the transmission mechanisms of the distributional effects of monetary policy shocks, giving an account of our empirical results. Section 6 concludes. …","https://ies.keio.ac.jp/upload/20201027macro_Yamada_WP.pdf","https://scholar.google.com/scholar?q=related:nAveQKaYsfMJ:scholar.google.com/&scioq=effect+of+%22monetary+policy%22+on+the+%22gdp+deflator%22&hl=en&as_sdt=0,5"
12,"T Van Hoa","Effects of monetary and fiscal policy on inflation: Some evidence from the J-test",1986,"Economics Letters","Elsevier","https://www.sciencedirect.com/science/article/pii/0165176586902296","https://scholar.google.com/scholar?cites=9716187970403361600&as_sdt=2005&sciodt=0,5&hl=en",287,"2023-02-09 16:27:49","","","","",,,,,12,0.32,12,1,37,"… by the rate of change in the consumer price index (or the implicit GDP deflator), M2 the rate … For convenience, we call the monetary policy approach to inflation Hi and the Keynesian …","","https://scholar.google.com/scholar?q=related:QOPQAnvV1oYJ:scholar.google.com/&scioq=effect+of+%22monetary+policy%22+on+the+%22gdp+deflator%22&hl=en&as_sdt=0,5"
2,"K Ullah, A Wajid, FA Khan","The impact of institutional quality on monetary policy in Pakistan",2016,"Global Journal of Management …","journalofbusiness.org","https://journalofbusiness.org/index.php/GJMBR/article/view/1975","https://scholar.google.com/scholar?cites=10451558009995327791&as_sdt=2005&sciodt=0,5&hl=en",288,"2023-02-09 16:27:49","","","","",,,,,2,0.29,1,3,7,"… effect of institutional quality on monetary policy. Based on recent literature, our premise is that institutional quality affects the outcomes of monetary policy. … , we have used GDP deflator. …","https://journalofbusiness.org/index.php/GJMBR/article/download/1975/1877","https://scholar.google.com/scholar?q=related:L_kop6JkC5EJ:scholar.google.com/&scioq=effect+of+%22monetary+policy%22+on+the+%22gdp+deflator%22&hl=en&as_sdt=0,5"
13,"DJ Lee, JH Yoon","The New Keynesian Phillips Curve in multiple quantiles and the asymmetry of monetary policy",2016,"Economic Modelling","Elsevier","https://www.sciencedirect.com/science/article/pii/S026499931630013X","https://scholar.google.com/scholar?cites=17945257081583831086&as_sdt=2005&sciodt=0,5&hl=en",289,"2023-02-09 16:27:49","","","","",,,,,13,1.86,7,2,7,"… 1 shows GDP deflator inflation and the GDP gap from the CBO, with the GDP gap on the left vertical axis and the right vertical axis indicating inflation. As can be seen from the figure, …","https://media.economics.uconn.edu/working/2012-03.pdf","https://scholar.google.com/scholar?q=related:Lgje1jxcCvkJ:scholar.google.com/&scioq=effect+of+%22monetary+policy%22+on+the+%22gdp+deflator%22&hl=en&as_sdt=0,5"
0,"H Chi, K Miyamoto","The role of the real exchange rate in China's monetary policy rules",2015,"","kansai-u.repo.nii.ac.jp","https://kansai-u.repo.nii.ac.jp/?action=pages_view_main&active_action=repository_view_main_item_detail&item_id=23411&item_no=1&page_id=13&block_id=21","",290,"2023-02-09 16:27:49","","","","",,,,,0,0.00,0,2,8,"… Adjusting China’s nominal expenditure with the quarterly GDP deflator estimated and the … Adjusting China’s nominal quarterly government revenue with the quarterly GDP deflator …","https://kansai-u.repo.nii.ac.jp/index.php?action=pages_view_main&active_action=repository_action_common_download&item_id=23411&item_no=1&attribute_id=19&file_no=1&page_id=13&block_id=21","https://scholar.google.com/scholar?q=related:wXIsz4EjuvMJ:scholar.google.com/&scioq=effect+of+%22monetary+policy%22+on+the+%22gdp+deflator%22&hl=en&as_sdt=0,5"
7,"C Gallès, F Portier","Does the length of the period really matter for the identification and the modelling of monetary policy shocks?",2004,"Available at SSRN 560322","papers.ssrn.com","https://papers.ssrn.com/sol3/papers.cfm?abstract_id=560322","https://scholar.google.com/scholar?cites=14748130012472932602&as_sdt=2005&sciodt=0,5&hl=en",291,"2023-02-09 16:27:49","","","","",,,,,7,0.37,4,2,19,"… We take CEE’s monetary policy VAR as benchmark. The variables we use are the real GDP, the GDP deflator, a PPI component (crude material for further processing), the Federal Fund …","https://repec.cepr.org/repec/cpr/ceprdp/DP4409.pdf","https://scholar.google.com/scholar?q=related:-vi5fhviq8wJ:scholar.google.com/&scioq=effect+of+%22monetary+policy%22+on+the+%22gdp+deflator%22&hl=en&as_sdt=0,5"
0,"C Kamps, C Pierdzioch","Kiel Institute of World Economics",2002,"","ifw-kiel.de","https://www.ifw-kiel.de/fileadmin/Dateiverwaltung/IfW-Publications/system/monetary-policy-rules-and-oil-price-shocks/kap1090.pdf","",292,"2023-02-09 16:27:49","PDF","","","",,,,,0,0.00,0,2,21,"… GDP deflator) when modeling the effects of oil price increases. This distinction has important implications for monetary policy … in the GDP deflator is an inferior monetary policy strategy in …","https://www.ifw-kiel.de/fileadmin/Dateiverwaltung/IfW-Publications/system/monetary-policy-rules-and-oil-price-shocks/kap1090.pdf","https://scholar.google.com/scholar?q=related:D-r3B_e2-tsJ:scholar.google.com/&scioq=effect+of+%22monetary+policy%22+on+the+%22gdp+deflator%22&hl=en&as_sdt=0,5"
48,"A Belke, A Rees","Globalisation and monetary policy—A FAVAR analysis for the G7 and the eurozone",2014,"The North American Journal of Economics and Finance","Elsevier","https://www.sciencedirect.com/science/article/pii/S1062940814000631","https://scholar.google.com/scholar?cites=15384385233558970109&as_sdt=2005&sciodt=0,5&hl=en",293,"2023-02-09 16:27:49","","","","",,,,,48,5.33,24,2,9,"… across countries ( X t 1 , X t 2 , ... , X t I ) : economic activity as reflected by real GDP; inflation which include consumer prices, producer prices, import prices and the GDP deflator; …","","https://scholar.google.com/scholar?q=related:_R4MJtxQgNUJ:scholar.google.com/&scioq=effect+of+%22monetary+policy%22+on+the+%22gdp+deflator%22&hl=en&as_sdt=0,5"
