Cites,Authors,Title,Year,Source,Publisher,ArticleURL,CitesURL,GSRank,QueryDate,Type,DOI,ISSN,CitationURL,Volume,Issue,StartPage,EndPage,ECC,CitesPerYear,CitesPerAuthor,AuthorCount,Age,Abstract,FullTextURL,RelatedURL
1,"M Ramedoust, R Alomran, ...","Investigating the Asymmetric Effects of Monetary Policy on the Macroeconomic Variables of Iran in the Short and Long Term Using the Technique",2022,"Economic Growth …","egdr.journals.pnu.ac.ir","https://egdr.journals.pnu.ac.ir/article_8798.html?lang=en","https://scholar.google.com/scholar?cites=14549812276024262790&as_sdt=2005&sciodt=0,5&hl=en",246,"2023-02-08 13:47:29","","","","",,,,,1,1.00,0,3,1,"… tools such as monetary policy. To achieve their … monetary policy in the short and long term. The purpose of this study is to investigate the effect of asymmetric shocks of monetary policy …","","https://scholar.google.com/scholar?q=related:hkALRS1R68kJ:scholar.google.com/&scioq=effect+of+%22monetary+policy%22+on+%22economic+growth%22&hl=en&as_sdt=0,5"
1,"DRW OLORI","Monetary Policy and Economic Growth in Nigeria",2017,"Journal of Economics and Sustainable Development","academia.edu","https://www.academia.edu/download/89776788/234647837.pdf","https://scholar.google.com/scholar?cites=11748494400590639858&as_sdt=2005&sciodt=0,5&hl=en",247,"2023-02-08 13:47:29","PDF","","","",,,,,1,0.17,1,1,6,"… monetary policy and real gross domestic product in Nigeria between 1980 to 2015. The specific objective of this study is to examine the impact … The study concludes that monetary policy …","https://www.academia.edu/download/89776788/234647837.pdf","https://scholar.google.com/scholar?q=related:8vLeQGkJC6MJ:scholar.google.com/&scioq=effect+of+%22monetary+policy%22+on+%22economic+growth%22&hl=en&as_sdt=0,5"
39,"S Ullah, I Ozturk, S Sohail","The asymmetric effects of fiscal and monetary policy instruments on Pakistan's environmental pollution",2021,"Environmental Science and Pollution …","Springer","https://link.springer.com/article/10.1007/s11356-020-11093-4","https://scholar.google.com/scholar?cites=13858941668163706691&as_sdt=2005&sciodt=0,5&hl=en",248,"2023-02-08 13:47:29","","10.1007/s11356-020-11093-4","","",,,,,39,19.50,13,3,2,"… in monetary policy instruments enhances carbon emissions in short-run, whereas positive shock in monetary policy … and monetary policy instruments to maintain economic growth along …","","https://scholar.google.com/scholar?q=related:Q9_B9QTaVMAJ:scholar.google.com/&scioq=effect+of+%22monetary+policy%22+on+%22economic+growth%22&hl=en&as_sdt=0,5"
16,"S Allayarov","Theoretical Study of Optimal Fiscal and Monetary Policies for Stimulating Economic Growth",2018,"Research Journal of Finance and Accounting","papers.ssrn.com","https://papers.ssrn.com/sol3/papers.cfm?abstract_id=3251670","https://scholar.google.com/scholar?cites=17805348983291730206&as_sdt=2005&sciodt=0,5&hl=en",249,"2023-02-08 13:47:29","","","","",,,,,16,3.20,16,1,5,"… to enable growth-forwarding effect of fiscal and monetary policy measures. However, the … simultaneously reflects the impact of fiscal and monetary policy effects in economic growth. This …","","https://scholar.google.com/scholar?q=related:Hln3QpBOGfcJ:scholar.google.com/&scioq=effect+of+%22monetary+policy%22+on+%22economic+growth%22&hl=en&as_sdt=0,5"
1,"VH Ibrahim","Monetary Policy and Economic Growth in Nigeria: An Autoregressive Distributed Lag (ARDL) Analysis.",2019,"Advances in Social Sciences Research Journal","researchgate.net","https://www.researchgate.net/profile/Victoria-Ibrahim-2/publication/335178526_Monetary_Policy_and_Economic_Growth_in_Nigeria_An_Autoregressive_Distributed_Lag_ARDL_Analysis/links/601d5c2c92851c4ed54f7492/Monetary-Policy-and-Economic-Growth-in-Nigeria-An-Autoregressive-Distributed-Lag-ARDL-Analysis.pdf","https://scholar.google.com/scholar?cites=9480189204126708902&as_sdt=2005&sciodt=0,5&hl=en",250,"2023-02-08 13:47:29","PDF","","","",,,,,1,0.25,1,1,4,"… The basic empirical question in this study is whether monetary policy affects economic growth in Nigeria. Theoretically, if the current or lagged terms of a variable, for example t …","https://www.researchgate.net/profile/Victoria-Ibrahim-2/publication/335178526_Monetary_Policy_and_Economic_Growth_in_Nigeria_An_Autoregressive_Distributed_Lag_ARDL_Analysis/links/601d5c2c92851c4ed54f7492/Monetary-Policy-and-Economic-Growth-in-Nigeria-An-Autoregressive-Distributed-Lag-ARDL-Analysis.pdf","https://scholar.google.com/scholar?q=related:pjR3W9plkIMJ:scholar.google.com/&scioq=effect+of+%22monetary+policy%22+on+%22economic+growth%22&hl=en&as_sdt=0,5"
13,"M Idris","Relative impact of monetary and fiscal policy on output growth in a small-open economy",2019,"American Research Journal of Humanities &Social …","academia.edu","https://www.academia.edu/download/76986537/D282638.pdf","https://scholar.google.com/scholar?cites=2375331611174109484&as_sdt=2005&sciodt=0,5&hl=en",251,"2023-02-08 13:47:29","PDF","","","",,,,,13,3.25,13,1,4,"… A worthy section of the economic literature debated and argued on the relationship between fiscal and monetary policy and how it affects economic growth. Certain number of studies …","https://www.academia.edu/download/76986537/D282638.pdf","https://scholar.google.com/scholar?q=related:LAHK64Pf9iAJ:scholar.google.com/&scioq=effect+of+%22monetary+policy%22+on+%22economic+growth%22&hl=en&as_sdt=0,5"
1,"F Nkikabahizi","Monetary policy and economic growth in Rwanda.",2013,"","dr.ur.ac.rw","http://dr.ur.ac.rw/handle/123456789/322","https://scholar.google.com/scholar?cites=3774554377513314532&as_sdt=2005&sciodt=0,5&hl=en",252,"2023-02-08 13:47:29","","","","",,,,,1,0.10,1,1,10,"… Chapter two presents the literature in relation to the topic under study, this chapter deals with the monetary policy theory behind economic growth. Chapter three briefly highlights the …","http://dr.ur.ac.rw/bitstream/handle/123456789/322/NKIKABAHIZI%20Ferdinand.pdf?sequence=1&isAllowed=y","https://scholar.google.com/scholar?q=related:5KgTOTXpYTQJ:scholar.google.com/&scioq=effect+of+%22monetary+policy%22+on+%22economic+growth%22&hl=en&as_sdt=0,5"
24,"B Fetai, Z Izet","The impact of monetary policy and exchange rate regime on real GDP and prices in the Republic of Macedonia",2010,"Economic and Business Review","ebrjournal.net","https://www.ebrjournal.net/home/vol12/iss4/3/","https://scholar.google.com/scholar?cites=196596208779113678&as_sdt=2005&sciodt=0,5&hl=en",253,"2023-02-08 13:47:29","","","","",,,,,24,1.85,12,2,13,"… fixed exchange rate to a more flexible one, depreciating the domestic currency in order to settle the problem of deficit in the current account, and thereby promoting fast economic growth…","https://www.ebrjournal.net/cgi/viewcontent.cgi?article=1256&context=home","https://scholar.google.com/scholar?q=related:zrR31DVzugIJ:scholar.google.com/&scioq=effect+of+%22monetary+policy%22+on+%22economic+growth%22&hl=en&as_sdt=0,5"
100,"H Ngalawa, N Viegi","Dynamic effects of monetary policy shocks in Malawi",2011,"South African Journal of Economics","Wiley Online Library","https://onlinelibrary.wiley.com/doi/abs/10.1111/j.1813-6982.2011.01284.x","https://scholar.google.com/scholar?cites=10124915384496350319&as_sdt=2005&sciodt=0,5&hl=en",254,"2023-02-08 13:47:29","","10.1111/j.1813-6982.2011.01284.x","","",,,,,100,8.33,50,2,12,"… and economic growth in line with the RBM Act of 1989. The bank responds to the output shock by loosening monetary policy … In response to the consumer price shock, monetary policy is …","https://repository.up.ac.za/bitstream/handle/2263/20385/Ngalawa_Dynamic%282011%29.pdf?sequence=1","https://scholar.google.com/scholar?q=related:b-TK6eXsgowJ:scholar.google.com/&scioq=effect+of+%22monetary+policy%22+on+%22economic+growth%22&hl=en&as_sdt=0,5"
24,"JC Chouraqui, M Driscoll, ...","The effects of monetary policy on the real sector: an overview of empirical evidence for selected OECD economies",1988,"OECD Economics …","ideas.repec.org","https://ideas.repec.org/p/oec/ecoaaa/51-en.html","https://scholar.google.com/scholar?cites=2035239798780163076&as_sdt=2005&sciodt=0,5&hl=en",255,"2023-02-08 13:47:29","","","","",,,,,24,0.69,8,3,35,"… of understanding about the effects of monetary policy, both at the … conduct and implementation of monetary policy which may have … in the rate of inflation, to slow economic growth, to ... …","","https://scholar.google.com/scholar?q=related:BHQHV9CfPhwJ:scholar.google.com/&scioq=effect+of+%22monetary+policy%22+on+%22economic+growth%22&hl=en&as_sdt=0,5"
0,"T Dzisah","The Effect of Monetary Policy on Economic Growth in the Ecowas Countries",2019,"","oatd.org","https://oatd.org/oatd/record?record=oai%5C%3Augspace.ug.edu.gh%5C%3A123456789%5C%2F32785","",256,"2023-02-08 13:47:29","","","","",,,,,0,0.00,0,1,4,"… on monetary policy and economic growth, there are however disagreements with regards to the impact of monetary policy on economic growth. … supply determines economic growth at …","","https://scholar.google.com/scholar?q=related:wV5MTjDyFsYJ:scholar.google.com/&scioq=effect+of+%22monetary+policy%22+on+%22economic+growth%22&hl=en&as_sdt=0,5"
103,"L Sun, JL Ford, DG Dickinson","Bank loans and the effects of monetary policy in China: VAR/VECM approach",2010,"China Economic Review","Elsevier","https://www.sciencedirect.com/science/article/pii/S1043951X09001527","https://scholar.google.com/scholar?cites=15820632689267865096&as_sdt=2005&sciodt=0,5&hl=en",257,"2023-02-08 13:47:29","","","","",,,,,103,7.92,34,3,13,"… effects of China's monetary policy on China's real economy. In addition, we investigate the effects of China's monetary policy … explanations for the rapid economic growth in China since …","","https://scholar.google.com/scholar?q=related:CHa-DZwtjtsJ:scholar.google.com/&scioq=effect+of+%22monetary+policy%22+on+%22economic+growth%22&hl=en&as_sdt=0,5"
72,"CAB Nneka","Investigating the performance of monetary policy on manufacturing sector in Nigeria: 1980-2009",2012,"Arabian Journal of Business and Management …","search.proquest.com","https://search.proquest.com/openview/709ce678dda90b2693de5bfa8284bba3/1.pdf?pq-origsite=gscholar&cbl=1606373","https://scholar.google.com/scholar?cites=15581359273597360630&as_sdt=2005&sciodt=0,5&hl=en",258,"2023-02-08 13:47:29","","","","",,,,,72,6.55,72,1,11,"… effective use of monetary policy. Ajayi and Ojo (1981) said that sources of features of monetary policy impacts on assessed on the basis of its impacts on economic growth as well as on …","","https://scholar.google.com/scholar?q=related:9lmCrLQbPNgJ:scholar.google.com/&scioq=effect+of+%22monetary+policy%22+on+%22economic+growth%22&hl=en&as_sdt=0,5"
40,"AM Khalid","Economic growth, inflation, and monetary policy in Pakistan: Preliminary empirical estimates",2005,"The Pakistan Development Review","JSTOR","https://www.jstor.org/stable/41261140","https://scholar.google.com/scholar?cites=6733288929399400348&as_sdt=2005&sciodt=0,5&hl=en",259,"2023-02-08 13:47:29","","","","",,,,,40,2.22,40,1,18,"… shocks to maintain and achieve sustainable economic growth. Pakistan is no different and … interest rates and low economic growth. The average economic growth over 40 years is …","https://www.pide.org.pk/pdfpdr/2005/961-974.pdf","https://scholar.google.com/scholar?q=related:nOfrVptycV0J:scholar.google.com/&scioq=effect+of+%22monetary+policy%22+on+%22economic+growth%22&hl=en&as_sdt=0,5"
2,"OK Okoroafor","Influences of monetary policy instruments on domestic investments and economic growth of Nigeria: 1970-2018",2020,"… Journal of Applied Economics, Finance and …","ideas.repec.org","https://ideas.repec.org/a/oap/ijaefa/v6y2020i1p42-56id226.html","https://scholar.google.com/scholar?cites=8509731137348739210&as_sdt=2005&sciodt=0,5&hl=en",260,"2023-02-08 13:47:29","","","","",,,,,2,0.67,2,1,3,"… the degree of effects of monetary variables on domestic investment and economic growth… Annual data on the following variables: private domestic investment (PDI), economic growth …","","https://scholar.google.com/scholar?q=related:iqDAB2KjGHYJ:scholar.google.com/&scioq=effect+of+%22monetary+policy%22+on+%22economic+growth%22&hl=en&as_sdt=0,5"
0,"NH Marf, NN Noori","The Effects of Monetary Policy on Economic Growth in Iraq (2004-2020)",2022,"Journal of Kurdistani for Strategic Studies","jkss.kissr.edu.iq","https://jkss.kissr.edu.iq/index.php/en/article/view/145","",261,"2023-02-08 13:47:29","","","","",,,,,0,0.00,0,2,1,"… This study aims to evaluate monetary policy with measuring its effects on the economic growth … between the money supply )M2( and economic growth. Also, there is a positive but weak …","https://jkss.kissr.edu.iq/index.php/en/article/download/145/126","https://scholar.google.com/scholar?q=related:r86EMkX2NpIJ:scholar.google.com/&scioq=effect+of+%22monetary+policy%22+on+%22economic+growth%22&hl=en&as_sdt=0,5"
2,"SF Ismail, SK Sek","Investigating the effects of fiscal and monetary policy on economic performance: Dynamic panel threshold regression analysis",2019,"AIP Conference Proceedings","aip.scitation.org","https://aip.scitation.org/doi/abs/10.1063/1.5136390","https://scholar.google.com/scholar?cites=8129796631980922960&as_sdt=2005&sciodt=0,5&hl=en",262,"2023-02-08 13:47:29","","10.1063/1.5136390","","",,,,,2,0.50,1,2,4,"… of variables on economic growth and (2) to compare the impacts of both policies on … comparing the impacts of fiscal policy versus monetary policy on economic growth using dynamic …","","https://scholar.google.com/scholar?q=related:UNhjmfbW0nAJ:scholar.google.com/&scioq=effect+of+%22monetary+policy%22+on+%22economic+growth%22&hl=en&as_sdt=0,5"
407,"CI Plosser, KG Rouwenhorst","International term structures and real economic growth",1994,"Journal of monetary economics","Elsevier","https://www.sciencedirect.com/science/article/pii/0304393294900175","https://scholar.google.com/scholar?cites=17852606090550153442&as_sdt=2005&sciodt=0,5&hl=en",263,"2023-02-08 13:47:29","","","","",,,,,407,14.03,204,2,29,"… current monetary policy and future economic growth is less … also has consequences for real economic growth through … and future economic growth strictly due to monetary policy and …","","https://scholar.google.com/scholar?q=related:4pA39qYywfcJ:scholar.google.com/&scioq=effect+of+%22monetary+policy%22+on+%22economic+growth%22&hl=en&as_sdt=0,5"
30,"LE Imoughele, M Ismaila","Monetary policy and balance of payments stability in Nigeria",2015,"International Journal of Academic …","kwpublications.com","https://kwpublications.com/papers_submitted/1625/monetary-policy-and-balance-of-payments-stability-in-nigeria.pdf","https://scholar.google.com/scholar?cites=15460874294998969796&as_sdt=2005&sciodt=0,5&hl=en",264,"2023-02-08 13:47:29","PDF","","","",,,,,30,3.75,15,2,8,"… regulatory authorities to enhance robust economic growth prospects. Therefore, this study intends to evaluate the impact of monetary policy variables on Nigeria balance of payment. …","https://kwpublications.com/papers_submitted/1625/monetary-policy-and-balance-of-payments-stability-in-nigeria.pdf","https://scholar.google.com/scholar?q=related:xK1hjkEPkNYJ:scholar.google.com/&scioq=effect+of+%22monetary+policy%22+on+%22economic+growth%22&hl=en&as_sdt=0,5"
163,"DL Kohn","Monetary policy and asset prices revisited",2009,"Cato J.","HeinOnline","https://heinonline.org/hol-cgi-bin/get_pdf.cgi?handle=hein.journals/catoj29&section=7","https://scholar.google.com/scholar?cites=5997784690225916376&as_sdt=2005&sciodt=0,5&hl=en",265,"2023-02-08 13:47:29","","","","",,,,,163,11.64,163,1,14,"… economic growth and price stability, the Federal Reserve has responded to this crisis by easing monetary policy … we have learned, particularly for monetary policy, from the collapse of …","https://ciaotest.cc.columbia.edu/journals/cato/v29i1/f_0016058_13933.pdf","https://scholar.google.com/scholar?q=related:2Ckx7GVpPFMJ:scholar.google.com/&scioq=effect+of+%22monetary+policy%22+on+%22economic+growth%22&hl=en&as_sdt=0,5"
5,"PT Iorember, G Jelilov, ...","Analysis of the impact of monetary policy shocks on domestic output growth in Nigeria: evidence from dynamic ARDL and VECM tests",2021,"… Journal of Public …","inderscienceonline.com","https://www.inderscienceonline.com/doi/abs/10.1504/IJPP.2021.121955","https://scholar.google.com/scholar?cites=10849754474193935211&as_sdt=2005&sciodt=0,5&hl=en",266,"2023-02-08 13:47:29","","10.1504/IJPP.2021.121955","","",,,,,5,2.50,2,3,2,"… policy on economic growth in Chile, Colombia, Japan, Portugal and United Kingdom using … monetary policy is not effective in maintain financial stability and ensuring economic growth …","","https://scholar.google.com/scholar?q=related:a9uItjUSkpYJ:scholar.google.com/&scioq=effect+of+%22monetary+policy%22+on+%22economic+growth%22&hl=en&as_sdt=0,5"
548,"EM Engen, JS Skinner","Fiscal policy and economic growth",1992,"","nber.org","https://www.nber.org/papers/w4223","https://scholar.google.com/scholar?cites=7171392708926282770&as_sdt=2005&sciodt=0,5&hl=en",267,"2023-02-08 13:47:29","","","","",,,,,548,17.68,274,2,31,"… government fiscal policy on economic growth, … economic growth. Three general approaches have been followed to measure the impact of government fiscal policy on economic growth. …","https://www.nber.org/system/files/working_papers/w4223/w4223.pdf","https://scholar.google.com/scholar?q=related:EpxgUKznhWMJ:scholar.google.com/&scioq=effect+of+%22monetary+policy%22+on+%22economic+growth%22&hl=en&as_sdt=0,5"
6,"HC Wallich","Central America: Monetary Policy and Economic Growth",1985,"Journal of Interamerican Studies and World Affairs","cambridge.org","https://www.cambridge.org/core/journals/journal-of-interamerican-studies-and-world-affairs/article/central-america-monetary-policy-and-economic-growth/0FED1312AF3B052B93FBE8B8F586498A","https://scholar.google.com/scholar?cites=4043374135855981855&as_sdt=2005&sciodt=0,5&hl=en",268,"2023-02-08 13:47:29","","","","",,,,,6,0.16,6,1,38,"… this regard, the Central American countries have industrialized much less than the small republics in the Far East, and accordingly have not enjoyed as rapid a rate of economic growth. …","","https://scholar.google.com/scholar?q=related:H6WylVrzHDgJ:scholar.google.com/&scioq=effect+of+%22monetary+policy%22+on+%22economic+growth%22&hl=en&as_sdt=0,5"
8,"A Nigora","MONETARY POLICY",2022,"Web of Scientist: International Scientific …","wos.academiascience.org","https://wos.academiascience.org/index.php/wos/article/view/2568","https://scholar.google.com/scholar?cites=16573955626911360943&as_sdt=2005&sciodt=0,5&hl=en",269,"2023-02-08 13:47:29","","","","",,,,,8,8.00,8,1,1,"… Monetary policy uses a variety of tools to control one or both of these to influence outcomes like economic growth, inflation, exchange rates with other currencies, and unemployment. …","https://wos.academiascience.org/index.php/wos/article/download/2568/2443","https://scholar.google.com/scholar?q=related:r2cjgdSEAuYJ:scholar.google.com/&scioq=effect+of+%22monetary+policy%22+on+%22economic+growth%22&hl=en&as_sdt=0,5"
4,"EO Okorafor","Monetary policy and economic development: Lessons from the deregulation policy in Nigeria",2010,"International Journal of Development and Management …","ajol.info","https://www.ajol.info/index.php/ijdmr/article/view/56244","https://scholar.google.com/scholar?cites=13688084027827011783&as_sdt=2005&sciodt=0,5&hl=en",270,"2023-02-08 13:47:29","","","","",,,,,4,0.31,4,1,13,"… According to Ogwuma (1996) some objectives of monetary policy are: prompting price … rate and stimulating economic growth. This is not exhaustive of the objectives of monetary policy. …","https://www.ajol.info/index.php/ijdmr/article/view/56244/44690","https://scholar.google.com/scholar?q=related:x8BTlubX9b0J:scholar.google.com/&scioq=effect+of+%22monetary+policy%22+on+%22economic+growth%22&hl=en&as_sdt=0,5"
7,"R Shaheen","Credit market conditions and impact of monetary policy in a developing economy context",2020,"International Economics and Economic Policy","Springer","https://link.springer.com/article/10.1007/s10368-020-00461-7","https://scholar.google.com/scholar?cites=7349176431833726942&as_sdt=2005&sciodt=0,5&hl=en",271,"2023-02-08 13:47:29","","10.1007/s10368-020-00461-7","","",,,,,7,2.33,7,1,3,"… To examine the impact of monetary policy changes on economic growth in Pakistan, we select two standard deviations, one standard deviation (SD) positive shock in broad money, and …","","https://scholar.google.com/scholar?q=related:3j8f8waF_WUJ:scholar.google.com/&scioq=effect+of+%22monetary+policy%22+on+%22economic+growth%22&hl=en&as_sdt=0,5"
32,"A Fatima, A Iqbal","The relative effectiveness of monetary and fiscal policies: An econometric study",2003,"Pakistan Economic and Social Review","JSTOR","https://www.jstor.org/stable/25825247","https://scholar.google.com/scholar?cites=8301342737333980048&as_sdt=2005&sciodt=0,5&hl=en",272,"2023-02-08 13:47:29","","","","",,,,,32,1.60,16,2,20,"… In the case of Indonesia we observed a unidirectional causality between monetary policy and economic growth and a unidirectional causality between fiscal policy and …","http://www.documents.pk/file/Punjab%20University%20(PU)%20-%20The%20Relative%20Effectiveness%20of%20Monetary%20and%20Fiscal%20Policies-%20An%20Econometric%20Study%20byandnbspAmbreen%20Fatima%20and%20Azhar%20Iqbal.pdf","https://scholar.google.com/scholar?q=related:kIuPuTxLNHMJ:scholar.google.com/&scioq=effect+of+%22monetary+policy%22+on+%22economic+growth%22&hl=en&as_sdt=0,5"
12,"V Cocriş, AE Nucu","Interest rate channel in Romania: assessing the effectiveness transmission of monetary policy impulses to inflation and economic growth.",2013,"Theoretical &Applied Economics","ebsco.ectap.ro","http://www.ebsco.ectap.ro/Theoretical_&_Applied_Economics_2013_February.pdf#page=37","https://scholar.google.com/scholar?cites=15347858531813094013&as_sdt=2005&sciodt=0,5&hl=en",273,"2023-02-08 13:47:29","PDF","","","",,,,,12,1.20,6,2,10,"… the effectiveness of monetary policy transmission mechanism in … , we study the impact of a positive monetary policy shock via short … of monetary policy impulses via interest rate channel. …","http://www.ebsco.ectap.ro/Theoretical_&_Applied_Economics_2013_February.pdf#page=37","https://scholar.google.com/scholar?q=related:ffKqqwSM_tQJ:scholar.google.com/&scioq=effect+of+%22monetary+policy%22+on+%22economic+growth%22&hl=en&as_sdt=0,5"
19,"OA Shobande","Monetary policy spillovers through industrial growth in Nigeria: A time series analysis",2019,"Economics and Business","sciendo.com","https://sciendo.com/downloadpdf/journals/eb/33/1/article-p94.xml","https://scholar.google.com/scholar?cites=10137624140267561468&as_sdt=2005&sciodt=0,5&hl=en",274,"2023-02-08 13:47:29","","","","",,,,,19,4.75,19,1,4,"… between monetary policy and economic growth, … monetary policy instruments fostering economic growth in Nigeria. Owalabi and Adegbite (2014) analysed the effect of monetary policy …","https://www.researchgate.net/profile/Olatunji-Shobande/publication/333340647_MONETARY_POLICY_SPILLOVERS_THROUGH_INDUSTRIAL_GROWTH_IN_NIGERIA_A_TIME_SERIES_ANALYSIS/links/5ce7d0a5a6fdccc9ddca8923/MONETARY-POLICY-SPILLOVERS-THROUGH-INDUSTRIAL-GROWTH-IN-NIGERIA-A-TIME-SERIES-ANALYSIS.pdf","https://scholar.google.com/scholar?q=related:_KESs3ETsIwJ:scholar.google.com/&scioq=effect+of+%22monetary+policy%22+on+%22economic+growth%22&hl=en&as_sdt=0,5"
2,"P Arwatchanakarn","Exchange rate policy, monetary policy and economic growth in Thailand: a macroeconomic study, 1950–2016",2018,"The University of Newcastle, Newcastle …","nova.newcastle.edu.au","https://nova.newcastle.edu.au/vital/access/services/Download/uon:32218/ATTACHMENT01","https://scholar.google.com/scholar?cites=7941053488078829145&as_sdt=2005&sciodt=0,5&hl=en",275,"2023-02-08 13:47:29","PDF","","","",,,,,2,0.40,2,1,5,"… economic growth, and that inflation targeting remains an effective, appropriate monetary policy … Although the policy interest rate is the main monetary policy instrument under inflation …","https://nova.newcastle.edu.au/vital/access/services/Download/uon:32218/ATTACHMENT01","https://scholar.google.com/scholar?q=related:WbZQ6xJKNG4J:scholar.google.com/&scioq=effect+of+%22monetary+policy%22+on+%22economic+growth%22&hl=en&as_sdt=0,5"
0,"MU Hassan, H Ali, SU Rahman, ...","The Nexus Between Monetary Policy and Economic Growth in Pakistan: Empirical Evidence Based on Bound Test Approach",2021,"Review of Applied …","ramss.spcrd.org","http://ramss.spcrd.org/index.php/ramss/article/view/167","",276,"2023-02-08 13:47:29","","","","",,,,,0,0.00,0,4,2,"… The objective of this research is to examine the monetary policy's impact on economic growth. Variables of study are Gross domestic product, Inflation, rate of interest, Exchange rate, …","http://ramss.spcrd.org/index.php/ramss/article/download/167/234","https://scholar.google.com/scholar?q=related:duXmUccR7YMJ:scholar.google.com/&scioq=effect+of+%22monetary+policy%22+on+%22economic+growth%22&hl=en&as_sdt=0,5"
