Cites,Authors,Title,Year,Source,Publisher,ArticleURL,CitesURL,GSRank,QueryDate,Type,DOI,ISSN,CitationURL,Volume,Issue,StartPage,EndPage,ECC,CitesPerYear,CitesPerAuthor,AuthorCount,Age,Abstract,FullTextURL,RelatedURL
55,"IJM Arnold, EB Vrugt","Firm size, industry mix and the regional transmission of monetary policy in Germany",2004,"German Economic Review","degruyter.com","https://www.degruyter.com/document/doi/10.1111/j.1465-6485.2004.00093.x/html","https://scholar.google.com/scholar?cites=12697451376064733431&as_sdt=2005&sciodt=0,5&hl=en",712,"2023-02-09 16:27:49","","10.1111/j.1465-6485.2004.00093.x","","",,,,,55,2.89,28,2,19,"… The regional GDP deflator (Pi) captures trends in the regional aggregate price level. To account for supply shocks, we constructed an energy variable by dividing the price index for oil …","","https://scholar.google.com/scholar?q=related:9yAip8BoNrAJ:scholar.google.com/&scioq=effect+of+%22monetary+policy%22+on+the+%22gdp+deflator%22&hl=en&as_sdt=0,5"
174,"CA Favero","How do European monetary and fiscal authorities behave?",2002,"Available at SSRN 323361","papers.ssrn.com","https://papers.ssrn.com/sol3/papers.cfm?abstract_id=323361","https://scholar.google.com/scholar?cites=1740346439200916934&as_sdt=2005&sciodt=0,5&hl=en",713,"2023-02-09 16:27:49","","","","",,,,,174,8.29,174,1,21,"… by anchoring more tightly domestic monetary policy to German monetary policy. All the main … The data-set, described in the appendix, contains observations on GDP, the GDP deflator, …","https://repec.unibocconi.it/igier/igi/wp/2002/214.pdf","https://scholar.google.com/scholar?q=related:xsWvnt3zJhgJ:scholar.google.com/&scioq=effect+of+%22monetary+policy%22+on+the+%22gdp+deflator%22&hl=en&as_sdt=0,5"
86,"A Nikolsko-Rzhevskyy, DH Papell, R Prodan","Deviations from rules-based policy and their effects",2014,"Journal of Economic …","Elsevier","https://www.sciencedirect.com/science/article/pii/S0165188914002565","https://scholar.google.com/scholar?cites=13215994198996726256&as_sdt=2005&sciodt=0,5&hl=en",714,"2023-02-09 16:27:49","","","","",,,,,86,9.56,29,3,9,"… statistical methodology for dividing monetary policy into “small… percentage change in the GDP deflator and the output gap as … We identify monetary policy eras by allowing for changes in …","https://media.hoover.org/sites/default/files/documents/2014PapellDeviationsfromRules-BasedPolicy.pdf","https://scholar.google.com/scholar?q=related:8LHS4LOkaLcJ:scholar.google.com/&scioq=effect+of+%22monetary+policy%22+on+the+%22gdp+deflator%22&hl=en&as_sdt=0,5"
1,"EM Mathenge","The relationship between monetary policy and gross domestic product in Kenya",2012,"","erepository.uonbi.ac.ke","http://erepository.uonbi.ac.ke/handle/11295/13186","https://scholar.google.com/scholar?cites=13047651486428492614&as_sdt=2005&sciodt=0,5&hl=en",715,"2023-02-09 16:27:49","","","","",,,,,1,0.09,1,1,11,"… income velocity of money, the GDP deflator, and real GDP. … of money is equal to the GDP deflator times real GDP. The … rate (the growth rate of the GDP deflator) plus the growth rate in …","http://erepository.uonbi.ac.ke/bitstream/handle/11295/13186/Abstract.pdf?sequence=3","https://scholar.google.com/scholar?q=related:RvOqweWRErUJ:scholar.google.com/&scioq=effect+of+%22monetary+policy%22+on+the+%22gdp+deflator%22&hl=en&as_sdt=0,5"
11,"R Jean Louis, M Osman, F Balli","Is the US Dollar a suitable anchor for the newly proposed GCC currency?",2010,"The World Economy","Wiley Online Library","https://onlinelibrary.wiley.com/doi/abs/10.1111/j.1467-9701.2010.01267.x","https://scholar.google.com/scholar?cites=8428152265262920725&as_sdt=2005&sciodt=0,5&hl=en",716,"2023-02-09 16:27:49","","10.1111/j.1467-9701.2010.01267.x","","",,,,,11,0.85,4,3,13,"… monetary policy, or austerely the use of the GDP deflator instead of CPI, which is not available for the period considered. In this paper we provide evidence that monetary policy that …","https://mpra.ub.uni-muenchen.de/34003/3/MPRA_paper_34003.pdf","https://scholar.google.com/scholar?q=related:FXTmu9TP9nQJ:scholar.google.com/&scioq=effect+of+%22monetary+policy%22+on+the+%22gdp+deflator%22&hl=en&as_sdt=0,5"
103,"S Kumar, DJ Webber, S Fargher","Money demand stability: A case study of Nigeria",2013,"Journal of Policy Modeling","Elsevier","https://www.sciencedirect.com/science/article/pii/S016189381300046X","https://scholar.google.com/scholar?cites=4257116829295860093&as_sdt=2005&sciodt=0,5&hl=en",717,"2023-02-09 16:27:49","","","","",,,,,103,10.30,34,3,10,"… During the 1980s and 1990s, monetary targeting was the dominant monetary policy … by the GDP deflator. Real output is constructed using nominal GDP deflated by GDP deflator and the …","https://www.econstor.eu/bitstream/10419/242504/1/aut-ewp201102.pdf","https://scholar.google.com/scholar?q=related:fVmEeTNRFDsJ:scholar.google.com/&scioq=effect+of+%22monetary+policy%22+on+the+%22gdp+deflator%22&hl=en&as_sdt=0,5"
2,"LP Feld, C Fuest, J Haucap, H Schweitzer, V Wieland, ...","The monetary policy strategy of the European Central Bank: Review and recommendations",2021,"","econstor.eu","https://www.econstor.eu/handle/10419/236574","https://scholar.google.com/scholar?cites=7173220273168667765&as_sdt=2005&sciodt=0,5&hl=en",718,"2023-02-09 16:27:49","BOOK","","","",,,,,2,1.00,0,6,2,"… π stands for the annual inflation rate, such as the GDP deflator or a consumer price index. … Two measures of inflation are used, the GDP deflator, which captures the prices of all goods …","https://www.econstor.eu/bitstream/10419/236574/1/1764874056.pdf","https://scholar.google.com/scholar?q=related:dVTZRdVljGMJ:scholar.google.com/&scioq=effect+of+%22monetary+policy%22+on+the+%22gdp+deflator%22&hl=en&as_sdt=0,5"
157,"M Rusnák, T Havranek, ...","How to solve the price puzzle? A meta‐analysis",2013,"Journal of Money, Credit …","Wiley Online Library","https://onlinelibrary.wiley.com/doi/abs/10.1111/j.1538-4616.2012.00561.x","https://scholar.google.com/scholar?cites=18155709833021523262&as_sdt=2005&sciodt=0,5&hl=en",719,"2023-02-09 16:27:49","","10.1111/j.1538-4616.2012.00561.x","","",,,,,157,15.70,52,3,10,"… case, estimate the underlying effect of monetary policy corrected for misspecification and other … a dummy that equals one when the GDP deflator is used instead of the usual consumer …","https://www.econstor.eu/bitstream/10419/83296/1/664478441.pdf","https://scholar.google.com/scholar?q=related:PoVQauYJ9vsJ:scholar.google.com/&scioq=effect+of+%22monetary+policy%22+on+the+%22gdp+deflator%22&hl=en&as_sdt=0,5"
5,"C Moons, K Hellinckx","Did monetary policy fuel the housing bubble? An application to Ireland",2019,"Journal of Policy Modeling","Elsevier","https://www.sciencedirect.com/science/article/pii/S0161893819300274","https://scholar.google.com/scholar?cites=9296395917780153949&as_sdt=2005&sciodt=0,5&hl=en",720,"2023-02-09 16:27:49","","","","",,,,,5,1.25,3,2,4,"… The causality also runs from the effect of monetary policy on housing prices rather than in … an increase in the GDP deflator has a positive effect. Noteworthly is also the large effect of an …","","https://scholar.google.com/scholar?q=related:XXatMtVuA4EJ:scholar.google.com/&scioq=effect+of+%22monetary+policy%22+on+the+%22gdp+deflator%22&hl=en&as_sdt=0,5"
3,"CE MOUSSIR, A Chatri","Sectoral effects of monetary policy: Evidence from Morocco",2017,"Finance &Finance Internationale","platform.almanhal.com","https://platform.almanhal.com/Files/2/108070","https://scholar.google.com/scholar?cites=6097254557132008336&as_sdt=2005&sciodt=0,5&hl=en",721,"2023-02-09 16:27:49","","","","",,,,,3,0.50,2,2,6,"… For that purpose, they estimate for each industrial sector a vector error correction model VECM that includes the interest rate, the overall GDP, the GDP deflator, and sectoral output. …","https://hal.science/hal-01449475/file/7735-18441-1-PB.pdf","https://scholar.google.com/scholar?q=related:kCv8DrfMnVQJ:scholar.google.com/&scioq=effect+of+%22monetary+policy%22+on+the+%22gdp+deflator%22&hl=en&as_sdt=0,5"
3,"C Cantore, F Ferroni, ...","The Missing Link: Labor Share and Monetary Policy",2019,"CEPR Discussion Papers …","imfs-frankfurt.de","https://www.imfs-frankfurt.de/fileadmin/user_upload/Events_2019/MMCN_Conference_2019/Slides_Papers/CANTORE-Slides.pdf","https://scholar.google.com/scholar?cites=1006854913388553668&as_sdt=2005&sciodt=0,5&hl=en",722,"2023-02-09 16:27:49","PDF","","","",,,,,3,0.75,1,3,4,"… ▶ The variables in the information set are: the log of Real GDP, the log of GDP deflator, the log of an index for price of commodities, log of CPI, log Labor Share, short term interest rates …","https://www.imfs-frankfurt.de/fileadmin/user_upload/Events_2019/MMCN_Conference_2019/Slides_Papers/CANTORE-Slides.pdf","https://scholar.google.com/scholar?q=related:xKXhjDUR-Q0J:scholar.google.com/&scioq=effect+of+%22monetary+policy%22+on+the+%22gdp+deflator%22&hl=en&as_sdt=0,5"
55,"AH Belke, W Orth","Global excess liquidity and house prices-a VAR analysis for OECD countries",2007,"Ruhr Economic Paper","papers.ssrn.com","https://papers.ssrn.com/sol3/papers.cfm?abstract_id=1089102","https://scholar.google.com/scholar?cites=8682696821011925333&as_sdt=2005&sciodt=0,5&hl=en",723,"2023-02-09 16:27:49","","","","",,,,,55,3.44,28,2,16,"… studies specifically dealing with the impacts of monetary policy on house prices are still quite … In the Cholesky ordering, we put house prices just behind the GDP deflator, so that we are …","https://www.econstor.eu/bitstream/10419/26802/1/55726037X.PDF","https://scholar.google.com/scholar?q=related:VUnUfMEif3gJ:scholar.google.com/&scioq=effect+of+%22monetary+policy%22+on+the+%22gdp+deflator%22&hl=en&as_sdt=0,5"
23,"S Kappes","Monetary policy and personal income distribution: a survey of the empirical literature",2022,"The Future of Central Banking","elgaronline.com","https://www.elgaronline.com/view/book/9781839100932/book-part-9781839100932-11.xml","https://scholar.google.com/scholar?cites=15597546977605861728&as_sdt=2005&sciodt=0,5&hl=en",724,"2023-02-09 16:27:49","","","","",,,,,23,23.00,23,1,1,"… a regression of the federal funds rate target for each FOMC meeting against GDP forecasts, GDP deflator and unemployment provided by the Greenbook. The monetary policy shock is …","https://www.researchgate.net/profile/Sylvio-Kappes/publication/353089076_Monetary_Policy_and_Personal_Income_Distribution_A_Survey_of_the_Empirical_Literature/links/639300bc484e65005bf86027/Monetary-Policy-and-Personal-Income-Distribution-A-Survey-of-the-Empirical-Literature.pdf","https://scholar.google.com/scholar?q=related:YEGqN1aeddgJ:scholar.google.com/&scioq=effect+of+%22monetary+policy%22+on+the+%22gdp+deflator%22&hl=en&as_sdt=0,5"
7,"K Ueda","Japanese Monetary Policy, Rules Or Discretion?",1996,"","Institute for Monetary and Economic …","","https://scholar.google.com/scholar?cites=6111222893623771166&as_sdt=2005&sciodt=0,5&hl=en",725,"2023-02-09 16:27:49","CITATION","","","",,,,,7,0.26,7,1,27,"","","https://scholar.google.com/scholar?q=related:HgCu1ddsz1QJ:scholar.google.com/&scioq=effect+of+%22monetary+policy%22+on+the+%22gdp+deflator%22&hl=en&as_sdt=0,5"
152,"A Belke, W Orth, R Setzer","Liquidity and the dynamic pattern of asset price adjustment: A global view",2010,"Journal of Banking &Finance","Elsevier","https://www.sciencedirect.com/science/article/pii/S0378426609003380","https://scholar.google.com/scholar?cites=111016093303534353&as_sdt=2005&sciodt=0,5&hl=en",726,"2023-02-09 16:27:49","","","","",,,,,152,11.69,51,3,13,"… As far as the impact of monetary policy on asset prices is … with the relationship between monetary policy and house prices. … theoretical considerations: The GDP deflator reacts slowly but …","https://www.econstor.eu/bitstream/10419/29799/1/611461064.pdf","https://scholar.google.com/scholar?q=related:EXO1dYxoigEJ:scholar.google.com/&scioq=effect+of+%22monetary+policy%22+on+the+%22gdp+deflator%22&hl=en&as_sdt=0,5"
211,"L Dedola, G Rivolta, L Stracca","If the Fed sneezes, who catches a cold?",2017,"Journal of International Economics","Elsevier","https://www.sciencedirect.com/science/article/pii/S0022199617300041","https://scholar.google.com/scholar?cites=9935588589505392521&as_sdt=2005&sciodt=0,5&hl=en",727,"2023-02-09 16:27:49","HTML","","","",,,,,211,35.17,70,3,6,"… by documenting the effects of US monetary policy shocks on a … First, we identify US monetary policy shocks assuming that … Inflation (both GDP deflator and CPI) also falls in a majority …","https://www.sciencedirect.com/science/article/pii/S0022199617300041","https://scholar.google.com/scholar?q=related:ia_kXy5N4okJ:scholar.google.com/&scioq=effect+of+%22monetary+policy%22+on+the+%22gdp+deflator%22&hl=en&as_sdt=0,5"
2,"R Valdes","MEP 1-Structural Macroeconomic Model for Chile: An Overview",2003,"Monetary Policy: Shocks and Effectiveness Conference …","bcb.gov.br","https://www.bcb.gov.br/conteudo/eventos/Documents/seminariodemetas/V/2003_VSemAnualMetasInflBCB_RodrigoVald%C3%A9s.pdf","https://scholar.google.com/scholar?cites=9855861024112487905&as_sdt=2005&sciodt=0,5&hl=en",728,"2023-02-09 16:27:49","PDF","","","",,,,,2,0.10,2,1,20,"… • Numerous runs when monetary policy report is under … gap has standard effects • Keeps track of price levels and costs … – GDP deflator is the relevant price – Core CPI represent a …","https://www.bcb.gov.br/conteudo/eventos/Documents/seminariodemetas/V/2003_VSemAnualMetasInflBCB_RodrigoVald%C3%A9s.pdf","https://scholar.google.com/scholar?q=related:4a3XAWINx4gJ:scholar.google.com/&scioq=effect+of+%22monetary+policy%22+on+the+%22gdp+deflator%22&hl=en&as_sdt=0,5"
98,"H Bunzel, W Enders","The Taylor rule and “opportunistic” monetary policy",2010,"Journal of Money, Credit and Banking","Wiley Online Library","https://onlinelibrary.wiley.com/doi/abs/10.1111/j.1538-4616.2010.00313.x","https://scholar.google.com/scholar?cites=14095253964003616267&as_sdt=2005&sciodt=0,5&hl=en",729,"2023-02-09 16:27:49","","10.1111/j.1538-4616.2010.00313.x","","",,,,,98,7.54,49,2,13,"… Our data set consists of the monthly values of the federal funds rate and the chain-weighted GDP deflator (p t ) obtained from the database of the Federal Reserve Bank of St. Louis (http:/…","http://time-series.net/yahoo_site_admin/assets/docs/jmcb_313.41165754.pdf","https://scholar.google.com/scholar?q=related:CyZa58xmnMMJ:scholar.google.com/&scioq=effect+of+%22monetary+policy%22+on+the+%22gdp+deflator%22&hl=en&as_sdt=0,5"
37,"W Thorbecke, L Coppock","Monetary policy, stock returns, and the role of credit in the transmission of monetary policy",1996,"Southern Economic Journal","JSTOR","https://www.jstor.org/stable/1060943","https://scholar.google.com/scholar?cites=5535272251646767021&as_sdt=2005&sciodt=0,5&hl=en",730,"2023-02-09 16:27:49","","","","",,,,,37,1.37,19,2,27,"… Since we are using monthly rather than quarterly data we employed industrial production growth rather than GDP and the CPI inflation rate rather than the GDP deflator. Otherwise we …","https://www.econstor.eu/bitstream/10419/186815/1/wp133.pdf","https://scholar.google.com/scholar?q=related:rW97Jsk80UwJ:scholar.google.com/&scioq=effect+of+%22monetary+policy%22+on+the+%22gdp+deflator%22&hl=en&as_sdt=0,5"
3,"M Doyle, B Falk","Testing commitment models of monetary policy: evidence from OECD economies",2004,"","academia.edu","https://www.academia.edu/download/32977686/p3835-2004-07-13.pdf","https://scholar.google.com/scholar?cites=18103855889591810925&as_sdt=2005&sciodt=0,5&hl=en",731,"2023-02-09 16:27:49","BOOK","","","",,,,,3,0.16,2,2,19,"… The results for the unemployment rate and the GDP deflator … the CPI inflation rate or the GDP deflator inflation rate. In this … the unemployment rate and the GDP deflator inflation can is …","https://www.academia.edu/download/32977686/p3835-2004-07-13.pdf","https://scholar.google.com/scholar?q=related:bbv7YwPRPfsJ:scholar.google.com/&scioq=effect+of+%22monetary+policy%22+on+the+%22gdp+deflator%22&hl=en&as_sdt=0,5"
68,"K Carstensen, O Hülsewig, T Wollmershäuser","Monetary policy transmission and house prices: European cross-country evidence",2009,"","papers.ssrn.com","https://papers.ssrn.com/sol3/papers.cfm?abstract_id=1447256","https://scholar.google.com/scholar?cites=8998227271780386579&as_sdt=2005&sciodt=0,5&hl=en",732,"2023-02-09 16:27:49","","","","",,,,,68,4.86,23,3,14,"… where yi,t denotes real GDP, pi,t is the overall price level, measured by the GDP deflator, si,t … prices – ie nominal house prices deflated with the GDP deflator. For each variable, we use a …","https://www.econstor.eu/bitstream/10419/30647/1/60802841X.pdf","https://scholar.google.com/scholar?q=related:E8ezbgcg4HwJ:scholar.google.com/&scioq=effect+of+%22monetary+policy%22+on+the+%22gdp+deflator%22&hl=en&as_sdt=0,5"
17,"M McGuire, M Ryan","Macroeconomic modelling developments in the Central Bank",2000,"Spring Bulletin","Citeseer","https://citeseerx.ist.psu.edu/document?repid=rep1&type=pdf&doi=62133b714c8b3a6e6a342e3aa71710486f8e58f2#page=77","https://scholar.google.com/scholar?cites=9806492933350166658&as_sdt=2005&sciodt=0,5&hl=en",733,"2023-02-09 16:27:49","PDF","","","",,,,,17,0.74,9,2,23,"… effects of the common monetary policy on the euro area and, as part of this analysis, the impact … maintained through the presence of the GDP deflator. Regarding the related balance of …","https://citeseerx.ist.psu.edu/document?repid=rep1&type=pdf&doi=62133b714c8b3a6e6a342e3aa71710486f8e58f2#page=77","https://scholar.google.com/scholar?q=related:ghC3qF2pF4gJ:scholar.google.com/&scioq=effect+of+%22monetary+policy%22+on+the+%22gdp+deflator%22&hl=en&as_sdt=0,5"
8,"I Boiciuc","The Macroeconomic Effects of Fiscal Policy. A BVAR Approach",2014,"Review of Economic and Business Studies","rebs.feaa.uaic.ro","http://rebs.feaa.uaic.ro/articles/pdfs/214.pdf","https://scholar.google.com/scholar?cites=18048444748628168240&as_sdt=2005&sciodt=0,5&hl=en",734,"2023-02-09 16:27:49","PDF","","","",,,,,8,0.89,8,1,9,"… of monetary policy to … by GDP deflator. The deflated series are then expressed in log. All the variables are used in first differences. As measurement for inflation it is used GDP deflator …","http://rebs.feaa.uaic.ro/articles/pdfs/214.pdf","https://scholar.google.com/scholar?q=related:MA4_xt_0ePoJ:scholar.google.com/&scioq=effect+of+%22monetary+policy%22+on+the+%22gdp+deflator%22&hl=en&as_sdt=0,5"
89,"MT Belongia, PN Ireland","Money and output: Friedman and Schwartz revisited",2016,"Journal of Money, Credit and …","Wiley Online Library","https://onlinelibrary.wiley.com/doi/abs/10.1111/jmcb.12332","https://scholar.google.com/scholar?cites=6473891703578818388&as_sdt=2005&sciodt=0,5&hl=en",735,"2023-02-09 16:27:49","","10.1111/jmcb.12332","","",,,,,89,12.71,45,2,7,"… the structural VAR associate monetary policy shocks not only … Our estimated VAR attributes to monetary policy shocks … for real GDP and the GDP deflator are available. Their starting …","https://www.nber.org/system/files/working_papers/w21796/w21796.pdf","https://scholar.google.com/scholar?q=related:VPcpSjTi11kJ:scholar.google.com/&scioq=effect+of+%22monetary+policy%22+on+the+%22gdp+deflator%22&hl=en&as_sdt=0,5"
25,"WG Choi, Y Wen","Dissecting Taylor rules in a structural VAR",2010,"","books.google.com","https://books.google.com/books?hl=en&lr=&id=7o0YEAAAQBAJ&oi=fnd&pg=PA3&dq=effect+of+%22monetary+policy%22+on+the+%22gdp+deflator%22&ots=ZyK-XIeC6p&sig=6ps6nChXKJ38x62iXte9wi950vY","https://scholar.google.com/scholar?cites=12667325561288561320&as_sdt=2005&sciodt=0,5&hl=en",736,"2023-02-09 16:27:49","BOOK","","","",,,,,25,1.92,13,2,13,"… We find that US monetary policy has been far more responsive over time to demand … GDP deflator inflation, since CPI was more susceptible to oil price changes than the GDP deflator…","https://www.elibrary.imf.org/openurl?genre=articlel&issn=1018-5941&volume=2010&issue=020&artnum=A001","https://scholar.google.com/scholar?q=related:qJLUznthy68J:scholar.google.com/&scioq=effect+of+%22monetary+policy%22+on+the+%22gdp+deflator%22&hl=en&as_sdt=0,5"
24,"JC Wu, J Zhang","Global effective lower bound and unconventional monetary policy",2019,"Journal of International Economics","Elsevier","https://www.sciencedirect.com/science/article/pii/S002219961830271X","https://scholar.google.com/scholar?cites=150428680440234142&as_sdt=2005&sciodt=0,5&hl=en",737,"2023-02-09 16:27:49","HTML","","","",,,,,24,6.00,12,2,4,"… monetary policy to provide further stimulus. In this extraordinary environment, how do we evaluate the role of unconventional monetary policy … rate, and monetary policy is completely …","https://www.sciencedirect.com/science/article/pii/S002219961830271X","https://scholar.google.com/scholar?q=related:nsCrfRZuFgIJ:scholar.google.com/&scioq=effect+of+%22monetary+policy%22+on+the+%22gdp+deflator%22&hl=en&as_sdt=0,5"
969,"BS Bernanke, J Boivin","Monetary policy in a data-rich environment",2003,"Journal of Monetary Economics","Elsevier","https://www.sciencedirect.com/science/article/pii/S0304393203000242","https://scholar.google.com/scholar?cites=13914832359562325496&as_sdt=2005&sciodt=0,5&hl=en",738,"2023-02-09 16:27:49","","","","",,,,,969,48.45,485,2,20,"… , most empirical analyses of monetary policy have been confined … the determinants and effects of monetary policy, generally limits … monetary policy is made in a “data-rich environment”. …","https://www.nber.org/system/files/working_papers/w8379/w8379.pdf","https://scholar.google.com/scholar?q=related:-K3SnE5qG8EJ:scholar.google.com/&scioq=effect+of+%22monetary+policy%22+on+the+%22gdp+deflator%22&hl=en&as_sdt=0,5"
113,"M Chen, J Wu, BN Jeon, R Wang","Monetary policy and bank risk-taking: Evidence from emerging economies",2017,"Emerging Markets Review","Elsevier","https://www.sciencedirect.com/science/article/pii/S1566014117301309","https://scholar.google.com/scholar?cites=9795284805488117658&as_sdt=2005&sciodt=0,5&hl=en",739,"2023-02-09 16:27:49","","","","",,,,,113,18.83,28,4,6,"… This paper addresses the impact of monetary policy on banks' … risk-taking channel” of monetary policy transmission, banks' … nominal GDP adjusted by the GDP deflator, and the inflation …","","https://scholar.google.com/scholar?q=related:mofmCKLX74cJ:scholar.google.com/&scioq=effect+of+%22monetary+policy%22+on+the+%22gdp+deflator%22&hl=en&as_sdt=0,5"
1,"A Maki, T Kamibayashi","Abenomics: Is deflation always bad?",2016,"","tiu.ac.jp","https://www.tiu.ac.jp/about/research_promotion/ronsou/pdf/1_economic_3.pdf","https://scholar.google.com/scholar?cites=1143348858087814476&as_sdt=2005&sciodt=0,5&hl=en",740,"2023-02-09 16:27:49","PDF","","","",,,,,1,0.14,1,2,7,"… The average increase in the GDP deflator during the 2nd … There is a trade-off between monetary policy and fiscal policy. … bears a trade-off between monetary policy by the BOJ and fiscal …","https://www.tiu.ac.jp/about/research_promotion/ronsou/pdf/1_economic_3.pdf","https://scholar.google.com/scholar?q=related:TDWsjLr93Q8J:scholar.google.com/&scioq=effect+of+%22monetary+policy%22+on+the+%22gdp+deflator%22&hl=en&as_sdt=0,5"
1,"PM Crowley, C Trombley","Are monetary unions more synchronous than non-monetary unions?",2015,"Bank of Finland Research Discussion …","papers.ssrn.com","https://papers.ssrn.com/sol3/papers.cfm?abstract_id=2647246","https://scholar.google.com/scholar?cites=6789504224109838169&as_sdt=2005&sciodt=0,5&hl=en",741,"2023-02-09 16:27:49","","","","",,,,,1,0.13,1,2,8,"… could be generated once the single monetary policy is allowed to endogenously cause greater … 5.2 GDP deflator inflation Here we repeat the exercise above, but for GSP/GDP deflator …","https://www.econstor.eu/bitstream/10419/212319/1/bof-rdp2015-011.pdf","https://scholar.google.com/scholar?q=related:Wb8Ulx4qOV4J:scholar.google.com/&scioq=effect+of+%22monetary+policy%22+on+the+%22gdp+deflator%22&hl=en&as_sdt=0,5"
8,"J Djivre, S Ribon","Monetary Policy, the Output Gap and Inflation: A Closer Look at the Monetary Policy Transmission Mechanism in Israel 1989-1999",2000,"","Citeseer","https://citeseerx.ist.psu.edu/document?repid=rep1&type=pdf&doi=893f951fc502eea47970b58eafdf1c9f66bf8d82","https://scholar.google.com/scholar?cites=11894256544286884552&as_sdt=2005&sciodt=0,5&hl=en",742,"2023-02-09 16:27:49","BOOK","","","",,,,,8,0.35,4,2,23,"… in which monetary policy affects prices through its effect on … only at a later stage is their effect felt on economic activity. The … need to link between the estimated DP to the GDP deflator: …","https://citeseerx.ist.psu.edu/document?repid=rep1&type=pdf&doi=893f951fc502eea47970b58eafdf1c9f66bf8d82","https://scholar.google.com/scholar?q=related:yMKV_U7jEKUJ:scholar.google.com/&scioq=effect+of+%22monetary+policy%22+on+the+%22gdp+deflator%22&hl=en&as_sdt=0,5"
3,"C Blot, P Hubert, F Labondance","The asymmetric effects of monetary policy on stock price bubbles",2020,"","ofce.sciences-po.fr","https://www.ofce.sciences-po.fr/pdf/dtravail/OFCEWP2020-12.pdf","https://scholar.google.com/scholar?cites=10542274071620019209&as_sdt=2005&sciodt=0,5&hl=en",743,"2023-02-09 16:27:49","BOOK","","","",,,,,3,1.00,1,3,3,"… instance to a “structural model” where the bubble component of stock prices is estimated from a VAR model including notably dividends, the nominal interest rate and the GDP deflator. …","https://www.ofce.sciences-po.fr/pdf/dtravail/OFCEWP2020-12.pdf","https://scholar.google.com/scholar?q=related:CeS4q2muTZIJ:scholar.google.com/&scioq=effect+of+%22monetary+policy%22+on+the+%22gdp+deflator%22&hl=en&as_sdt=0,5"
