Cites,Authors,Title,Year,Source,Publisher,ArticleURL,CitesURL,GSRank,QueryDate,Type,DOI,ISSN,CitationURL,Volume,Issue,StartPage,EndPage,ECC,CitesPerYear,CitesPerAuthor,AuthorCount,Age,Abstract,FullTextURL,RelatedURL
0,"AG Amiri, Z Gang, A Mazinani","A Mixture Approach with Some Bayesian Models: Application to Determine Effective Variables of Fiscal and Monetary Policy on Economic Growth",2019,"… 2019 10th International Conference on E …","dl.acm.org","https://dl.acm.org/doi/abs/10.1145/3345035.3345062","",499,"2023-02-08 13:47:29","","10.1145/3345035.3345062","","",,,,,0,0.00,0,3,4,"… of fiscal and monetary policy on economic growth with … on economic growth with considering 62 indicators base on empirical data for determining affecting variables on economic growth…","","https://scholar.google.com/scholar?q=related:Qc_GB8-ITx8J:scholar.google.com/&scioq=effect+of+%22monetary+policy%22+on+%22economic+growth%22&hl=en&as_sdt=0,5"
19,"R Lomivorotov","Impact of external shocks and monetary policy on Russian economy",2014,"Voprosy Economiki","ideas.repec.org","https://ideas.repec.org/a/nos/voprec/2014-11-8.html","https://scholar.google.com/scholar?cites=6295561572703110231&as_sdt=2005&sciodt=0,5&hl=en",500,"2023-02-08 13:47:29","","","","",,,,,19,2.11,19,1,9,"… impact of external and internal shocks on the Russian economy. We have factored in the US monetary policy … of the monetary policy of the Bank of Russia, on economic growth, inflation, …","","https://scholar.google.com/scholar?q=related:V4SRIuVTXlcJ:scholar.google.com/&scioq=effect+of+%22monetary+policy%22+on+%22economic+growth%22&hl=en&as_sdt=0,5"
51,"GA Kahn, R Hampton","Possible monetary policy responses to the Iraqi oil shock",1990,"Federal Reserve Bank of Kansas City Economic …","core.ac.uk","https://core.ac.uk/download/pdf/7359388.pdf","https://scholar.google.com/scholar?cites=5311705028684959418&as_sdt=2005&sciodt=0,5&hl=en",501,"2023-02-08 13:47:29","PDF","","","",,,,,51,1.55,26,2,33,"… economic growth. If policymakers try to offset the inﬂation … fully the effects of the oil-price shock and monetary policy on … the demand effects of higher oil prices by easing monetary policy. …","https://core.ac.uk/download/pdf/7359388.pdf","https://scholar.google.com/scholar?q=related:uk5supT3tkkJ:scholar.google.com/&scioq=effect+of+%22monetary+policy%22+on+%22economic+growth%22&hl=en&as_sdt=0,5"
6,"J Juaris, R Masbar, C Seftarita","Analysis of The Effect of Monetary Policy on Government Sharia Securities (SBSN) in Indonesia",2018,"Sriwijaya International Journal of …","sijdeb.unsri.ac.id","http://sijdeb.unsri.ac.id/index.php/SIJDEB/article/view/79","https://scholar.google.com/scholar?cites=14215235711327157166&as_sdt=2005&sciodt=0,5&hl=en",502,"2023-02-08 13:47:29","","","","",,,,,6,1.20,2,3,5,"… This study aims to analyze the effect of monetary policy (inflation, exchange rate and BI Rate) … through revenue, the investment sector needs to be developed to foster economic growth. …","http://sijdeb.unsri.ac.id/index.php/SIJDEB/article/viewFile/79/81","https://scholar.google.com/scholar?q=related:rjsaXJCpRsUJ:scholar.google.com/&scioq=effect+of+%22monetary+policy%22+on+%22economic+growth%22&hl=en&as_sdt=0,5"
11,"FF Noumbissie","The impact of monetary policy on financial market in South Africa: a VAR analysis",2014,"Journal of Economics and Behavioral …","ojs.amhinternational.com","https://ojs.amhinternational.com/index.php/jebs/article/view/524","https://scholar.google.com/scholar?cites=10558343697468297611&as_sdt=2005&sciodt=0,5&hl=en",503,"2023-02-08 13:47:29","","","","",,,,,11,1.22,11,1,9,"… They represent important factors in the monetary policy transmission mechanism to the economy and constitute key factors for economic stability and long-term economic growth. On the …","https://ojs.amhinternational.com/index.php/jebs/article/download/524/524","https://scholar.google.com/scholar?q=related:ixEVAKfFhpIJ:scholar.google.com/&scioq=effect+of+%22monetary+policy%22+on+%22economic+growth%22&hl=en&as_sdt=0,5"
0,"JI Okolie, DO Okolie","Financial Market, Monetary Policy and Economic Growth: Evidence from Nigeria",,"iiardjournals.org","","https://iiardjournals.org/get/IJEBM/VOL.%208%20NO.%202%202022/FINANCIAL%20MARKET,%20MONETARY.pdf","",504,"2023-02-08 13:47:29","PDF","","","",,,,,0,0.00,0,2,,"… the impact of financial market and monetary policy on the … market capitalization, while monetary policy was proxied by … had positive and significant impact on Gross Domestic Product, …","https://iiardjournals.org/get/IJEBM/VOL.%208%20NO.%202%202022/FINANCIAL%20MARKET,%20MONETARY.pdf","https://scholar.google.com/scholar?q=related:tJbHiAlM66gJ:scholar.google.com/&scioq=effect+of+%22monetary+policy%22+on+%22economic+growth%22&hl=en&as_sdt=0,5"
27,"A Chowdhury, H Siregar","Indonesia's monetary policy dilemma: Constraints of inflation targeting",2004,"The Journal of Developing Areas","JSTOR","https://www.jstor.org/stable/4192963","https://scholar.google.com/scholar?cites=1106658433252057311&as_sdt=2005&sciodt=0,5&hl=en",505,"2023-02-08 13:47:29","","","","",,,,,27,1.42,14,2,19,"… (inflation) to shock to inflation (economic growth) are not symmetric in terms of magnitude… monetary policy, tends to affect economic growth negatively, but the absolute value of this effect …","","https://scholar.google.com/scholar?q=related:3-CtUfujWw8J:scholar.google.com/&scioq=effect+of+%22monetary+policy%22+on+%22economic+growth%22&hl=en&as_sdt=0,5"
57,"SH Axilrod","US monetary policy in recent years: an overview",1985,"Fed. Res. Bull.","HeinOnline","https://heinonline.org/hol-cgi-bin/get_pdf.cgi?handle=hein.journals/fedred71&section=6","https://scholar.google.com/scholar?cites=5784260737044883288&as_sdt=2005&sciodt=0,5&hl=en",506,"2023-02-08 13:47:29","","","","",,,,,57,1.50,57,1,38,"… US monetary policy in recent years, in terms of its basic thrust, has aimed at curbing inflation and setting the stage for sustainable economic growth. In the process, the shorter-term …","","https://scholar.google.com/scholar?q=related:WKfMd37SRVAJ:scholar.google.com/&scioq=effect+of+%22monetary+policy%22+on+%22economic+growth%22&hl=en&as_sdt=0,5"
0,"NK Dhakal, MP Timsina","Price and output effects of Monetary policy in Low Income Countries: The Case of Nepal",2020,"Advances in Social Sciences Research …","researchgate.net","https://www.researchgate.net/profile/Nanda-Dhakal/publication/342015071_Price_and_output_effects_of_Monetary_policy_in_Low_Income_Countries_The_Case_of_Nepal/links/5eede6a8299bf1faac66592a/Price-and-output-effects-of-Monetary-policy-in-Low-Income-Countries-The-Case-of-Nepal.pdf","",507,"2023-02-08 13:47:29","PDF","","","",,,,,0,0.00,0,2,3,"… impact of monetary policy on economic growth and inflation in Nepal. The impact on economic growth and inflation have been observed using monetary policy instruments/indicators …","https://www.researchgate.net/profile/Nanda-Dhakal/publication/342015071_Price_and_output_effects_of_Monetary_policy_in_Low_Income_Countries_The_Case_of_Nepal/links/5eede6a8299bf1faac66592a/Price-and-output-effects-of-Monetary-policy-in-Low-Income-Countries-The-Case-of-Nepal.pdf","https://scholar.google.com/scholar?q=related:UAqfrIfBgb0J:scholar.google.com/&scioq=effect+of+%22monetary+policy%22+on+%22economic+growth%22&hl=en&as_sdt=0,5"
12,"F Ali, B Adeeb, S Saeed","Impact of monetary policy on stock returns: Evidence from manufacturing sectors of Pakistan",2014,"Basic Research Journal of Business …","researchgate.net","https://www.researchgate.net/profile/Babar-Adeeb/publication/327282413_Impact_of_monetary_policy_on_stock_returns_Evidence_from_manufacturing_sectors_of_Pakistan/links/5b8677b9a6fdcc5f8b6ed3a2/Impact-of-monetary-policy-on-stock-returns-Evidence-from-manufacturing-sectors-of-Pakistan.pdf","https://scholar.google.com/scholar?cites=16771779981768932609&as_sdt=2005&sciodt=0,5&hl=en",508,"2023-02-08 13:47:29","PDF","","","",,,,,12,1.33,4,3,9,"… This study investigates the dynamic impact of monetary policy on stock return in the … low due to loose monetary policy in early 2000s. This boost economic growth in year 2004 …","https://www.researchgate.net/profile/Babar-Adeeb/publication/327282413_Impact_of_monetary_policy_on_stock_returns_Evidence_from_manufacturing_sectors_of_Pakistan/links/5b8677b9a6fdcc5f8b6ed3a2/Impact-of-monetary-policy-on-stock-returns-Evidence-from-manufacturing-sectors-of-Pakistan.pdf","https://scholar.google.com/scholar?q=related:AT1YYAhVwegJ:scholar.google.com/&scioq=effect+of+%22monetary+policy%22+on+%22economic+growth%22&hl=en&as_sdt=0,5"
26,"RW Ferguson Jr","Monetary credibility, inflation, and economic growth",2006,"Cato J.","HeinOnline","https://heinonline.org/hol-cgi-bin/get_pdf.cgi?handle=hein.journals/catoj26&section=18","https://scholar.google.com/scholar?cites=6585558321783957265&as_sdt=2005&sciodt=0,5&hl=en",509,"2023-02-08 13:47:29","","","","",,,,,26,1.53,26,1,17,"… a primary and essential goal for monetary policy, in large part because we believe it brings stability to financial systems and fosters sustainable economic growth over the longer run. In …","https://citeseerx.ist.psu.edu/document?repid=rep1&type=pdf&doi=e88cc357825348140905fa6bf9302e229c64db7d","https://scholar.google.com/scholar?q=related:EeeM4WaaZFsJ:scholar.google.com/&scioq=effect+of+%22monetary+policy%22+on+%22economic+growth%22&hl=en&as_sdt=0,5"
15,"S Brima, AS Brima","Monetary policy effect on private sector investment: Evidence from Sierra Leone",2017,"… Journal of Economics and Financial Issues","dergipark.org.tr","https://dergipark.org.tr/en/pub/ijefi/issue/32002/353225","https://scholar.google.com/scholar?cites=6027643162604127354&as_sdt=2005&sciodt=0,5&hl=en",510,"2023-02-08 13:47:29","","","","",,,,,15,2.50,8,2,6,"… in promoting economic growth and enhancing job creation, and monetary policy has always … The study therefore examines the rate at which changes in monetary policy in Sierra Leone …","https://dergipark.org.tr/en/download/article-file/364224","https://scholar.google.com/scholar?q=related:esTUQ4V9plMJ:scholar.google.com/&scioq=effect+of+%22monetary+policy%22+on+%22economic+growth%22&hl=en&as_sdt=0,5"
0,"P Dörr","The Impact of Monetary Policy on Economic Inequality",2018,"","Springer","https://link.springer.com/content/pdf/10.1007/978-3-658-24835-2.pdf","",511,"2023-02-08 13:47:29","BOOK","10.1007/978-3-658-24835-2","","",,,,,0,0.00,0,1,5,"… SQUIRE (1998)), an empirical validation of the monetary policy impact on the income distribution must control for economic growth. Alternatively to a monetary growth rule or an interest …","","https://scholar.google.com/scholar?q=related:4DPSaWbJPP4J:scholar.google.com/&scioq=effect+of+%22monetary+policy%22+on+%22economic+growth%22&hl=en&as_sdt=0,5"
3,"JC Williams","The role of monetary policy in bolstering economic growth",2012,"Presentation to Community Leaders Salt Lake City …","frbsf.org","https://www.frbsf.org/wp-content/uploads/john-williams-1114.pdf","https://scholar.google.com/scholar?cites=9888803891887506548&as_sdt=2005&sciodt=0,5&hl=en",512,"2023-02-08 13:47:29","PDF","","","",,,,,3,0.27,3,1,11,"… Our decisions about monetary policy influence how fast the economy grows and the rate of … Federal Reserve has taken to bolster economic growth and move our economy towards our …","https://www.frbsf.org/wp-content/uploads/john-williams-1114.pdf","https://scholar.google.com/scholar?q=related:dIR0Hb8WPIkJ:scholar.google.com/&scioq=effect+of+%22monetary+policy%22+on+%22economic+growth%22&hl=en&as_sdt=0,5"
3,"C Pfister, N Valla","Financial Stability Is Easier to Green Than Monetary Policy",2021,"Intereconomics","Springer","https://link.springer.com/article/10.1007/s10272-021-0972-y","https://scholar.google.com/scholar?cites=12766149003733260804&as_sdt=2005&sciodt=0,5&hl=en",513,"2023-02-08 13:47:29","","10.1007/s10272-021-0972-y","","",,,,,3,1.50,2,2,2,"… impacts of climate risks on the two main variables of interest for monetary policy, economic growth … On that basis, it infers the potential consequences for the objective of monetary policy, …","https://link.springer.com/content/pdf/10.1007/s10272-021-0972-y.pdf","https://scholar.google.com/scholar?q=related:BFo6heF4KrEJ:scholar.google.com/&scioq=effect+of+%22monetary+policy%22+on+%22economic+growth%22&hl=en&as_sdt=0,5"
0,"VV Bondarchuk","THE IMPACT OF MONETARY FACTORS ON ECONOMIC GROWTH UNDER CONDITIONS OF SUSTAINABLE DEVELOPMENT",,"ДОПОВІДІ НА ПЛЕНАРНОМУ ЗАСІДАННІ","","","",514,"2023-02-08 13:47:29","CITATION","","","",,,,,0,0.00,0,1,,"","","https://scholar.google.com/scholar?q=related:UjlZFjynrCwJ:scholar.google.com/&scioq=effect+of+%22monetary+policy%22+on+%22economic+growth%22&hl=en&as_sdt=0,5"
0,"AB Muhammed, UM Tela, ...","WEST AFRICAN MONETARY POLICY, EXTERNAL SHOCKS AND ECONOMIC GROWTH DYNAMICS: AN S-VAR MODEL",2022,"Labuan Bulletin of …","jurcon.ums.edu.my","https://jurcon.ums.edu.my/ojums/index.php/lbibf/article/view/3900","",515,"2023-02-08 13:47:29","","","","",,,,,0,0.00,0,3,1,"… Although there is a wealth of economic literature on monetary policy shocks to economic growth in advanced and emerging nations, there is still a scarcity of knowledge on this topic in …","https://jurcon.ums.edu.my/ojums/index.php/lbibf/article/download/3900/2634","https://scholar.google.com/scholar?q=related:vHuMC6zs3qoJ:scholar.google.com/&scioq=effect+of+%22monetary+policy%22+on+%22economic+growth%22&hl=en&as_sdt=0,5"
0,"AI Imoisi","Does Monetary Policy Induce Economic Growth? An Empirical Evaluation of the Nigerian Economy",2019,"SRIWIJAYA INTERNATIONAL JOURNAL OF …","sijdeb.unsri.ac.id","http://sijdeb.unsri.ac.id/index.php/SIJDEB/article/view/101","",516,"2023-02-08 13:47:29","","","","",,,,,0,0.00,0,1,4,"… There are basically two divergent views as regards how monetary policy can influence economic growth. They are the Keynesians and the Monetarist views. The Keynesians suggest …","http://sijdeb.unsri.ac.id/index.php/SIJDEB/article/viewFile/101/96","https://scholar.google.com/scholar?q=related:Gu_MFOcfftEJ:scholar.google.com/&scioq=effect+of+%22monetary+policy%22+on+%22economic+growth%22&hl=en&as_sdt=0,5"
2,"ME Waugh","Comment on: Innovation, productivity, and monetary policy",2018,"Journal of Monetary Economics","Elsevier","https://www.sciencedirect.com/science/article/pii/S0304393217301289","https://scholar.google.com/scholar?cites=7197421292467324837&as_sdt=2005&sciodt=0,5&hl=en",517,"2023-02-08 13:47:29","","","","",,,,,2,0.40,2,1,5,"… What measurement do we need to get a compelling estimate of how monetary policy affects trends in economic growth? As discussed in the previous section, Moran and Queralto (2017…","","https://scholar.google.com/scholar?q=related:pQdZLIhg4mMJ:scholar.google.com/&scioq=effect+of+%22monetary+policy%22+on+%22economic+growth%22&hl=en&as_sdt=0,5"
2,"P Commodore","An empirical investigation into the effect of monetary policy on inflation in Ghana",2017,"","ir.knust.edu.gh","http://ir.knust.edu.gh/handle/123456789/10254","https://scholar.google.com/scholar?cites=6678246642061390578&as_sdt=2005&sciodt=0,5&hl=en",518,"2023-02-08 13:47:29","","","","",,,,,2,0.33,2,1,6,"… Economic growth was also found to have a negative impact on inflation in the long- … This chapter focuses on reviewed literature on the effects of monetary policy on inflation. It is …","http://ir.knust.edu.gh/bitstream/123456789/10254/1/final%20work%20and%20printed%20%282%29.pdf","https://scholar.google.com/scholar?q=related:8rKDJvDlrVwJ:scholar.google.com/&scioq=effect+of+%22monetary+policy%22+on+%22economic+growth%22&hl=en&as_sdt=0,5"
0,"L Agrawal, M Agrawal","Effect of Monetary Policy in the Economic Development of India",2014,"Asian Journal of Management","indianjournals.com","https://www.indianjournals.com/ijor.aspx?target=ijor:ajm&volume=5&issue=4&article=003","",519,"2023-02-08 13:47:29","","","","",,,,,0,0.00,0,2,9,"… ABSTRACT: Monetary policy plays a significant role in maintaining economic activities of … monetary policy strategy and an appropriate monetary policy will be an aid of economic growth …","http://dspace.stellamariscollege.edu.in:8080/xmlui/bitstream/handle/123456789/5151/monetary.pdf?sequence=1&isAllowed=y","https://scholar.google.com/scholar?q=related:kz8AG6-Uz8sJ:scholar.google.com/&scioq=effect+of+%22monetary+policy%22+on+%22economic+growth%22&hl=en&as_sdt=0,5"
0,"K Ogunbadejo Hussain, E Oladipo Agnes","IMPACT OF MONETARY POLICY ON FISHERY FOR ECONOMIC GROWTH OF NIGERIA",,"academiascholarlyjournal.org","","http://www.academiascholarlyjournal.org/ijarsfs/publications/dec16/Ogunbadejo_and_Oladipo.pdf","",520,"2023-02-08 13:47:29","PDF","","","",,,,,0,0.00,0,2,,"… This study examined the impact of monetary policy on fishery growth in Nigeria economy. It … supply and interest rate are significant monetary policy instruments that drive the growth in …","http://www.academiascholarlyjournal.org/ijarsfs/publications/dec16/Ogunbadejo_and_Oladipo.pdf","https://scholar.google.com/scholar?q=related:d-aasV42bt0J:scholar.google.com/&scioq=effect+of+%22monetary+policy%22+on+%22economic+growth%22&hl=en&as_sdt=0,5"
13,"S Yakubovskiy, H Alekseievska, ...","Impact of the European central bank monetary policy on the financial indicators of the Eastern European countries",2020,"Journal Global Policy and …","ideas.repec.org","https://ideas.repec.org/a/ase/jgpgta/v9y2020i1p37-49id296.html","https://scholar.google.com/scholar?cites=7045240009711892755&as_sdt=2005&sciodt=0,5&hl=en",521,"2023-02-08 13:47:29","","","","",,,,,13,4.33,4,3,3,"… demonstrate that the ECB monetary policy had an overall positive impact on the economies … monetary policy, these countries managed to achieve sustainable economic growth along …","","https://scholar.google.com/scholar?q=related:Ezk_KHa4xWEJ:scholar.google.com/&scioq=effect+of+%22monetary+policy%22+on+%22economic+growth%22&hl=en&as_sdt=0,5"
0,"JMG LALANI","THE IMPACT OF MONETARY POLICY ON THE MACROECONOMIC PERFORMANCE IN SRI LANKA.",2017,"","repository.kln.ac.lk","http://repository.kln.ac.lk/handle/123456789/17930","",522,"2023-02-08 13:47:29","","","","",,,,,0,0.00,0,1,6,"… the impact of monetary policy … monetary policy affect on macroeconomic performance in Sri Lanka. Specific objectives are to examine the impact of monetary policy on economic growth, …","","https://scholar.google.com/scholar?q=related:Ukt039M8cQ8J:scholar.google.com/&scioq=effect+of+%22monetary+policy%22+on+%22economic+growth%22&hl=en&as_sdt=0,5"
3,"M Saeed","The Effects of Monetary Policy on Poverty Alleviation in Pakistan",2020,"Available at SSRN 3693375","papers.ssrn.com","https://papers.ssrn.com/sol3/papers.cfm?abstract_id=3693375","https://scholar.google.com/scholar?cites=7424417288002338480&as_sdt=2005&sciodt=0,5&hl=en",523,"2023-02-08 13:47:29","","","","",,,,,3,1.00,3,1,3,"… Conversely, monetary policy tightening in most of the … rate which may badly affects economic growth of the region thereby … played by monetary policy in indorsing economic growth in the …","https://journal.kinnaird.edu.pk/wp-content/uploads/2018/03/4.-Maryam-Saeed.pdf","https://scholar.google.com/scholar?q=related:sP6l6y_UCGcJ:scholar.google.com/&scioq=effect+of+%22monetary+policy%22+on+%22economic+growth%22&hl=en&as_sdt=0,5"
1,"GN Nehra","IMPACT OF MONETARY POLICY ON INDIAN ECONOMY",2015,"… Research Journal of Management Sociology & …","academia.edu","https://www.academia.edu/download/43853700/3762.pdf","https://scholar.google.com/scholar?cites=12060818894002691256&as_sdt=2005&sciodt=0,5&hl=en",524,"2023-02-08 13:47:29","PDF","","","",,,,,1,0.13,1,1,8,"… By monetary policy, we mean policy concerned with changes in the supply of money. Issues … to what extent monetary policy facilitated economic growth in India and its general impact in …","https://www.academia.edu/download/43853700/3762.pdf","https://scholar.google.com/scholar?q=related:uJxZFeKiYKcJ:scholar.google.com/&scioq=effect+of+%22monetary+policy%22+on+%22economic+growth%22&hl=en&as_sdt=0,5"
2,"RO Iyiola, AA Adetunji","The effect of monetary policy on consumer price index",2014,"IJISET-International Journal of Innovative Science …","ijiset.com","https://www.ijiset.com/v1s6/IJISET_V1_I6_22.pdf","https://scholar.google.com/scholar?cites=8848365764803142386&as_sdt=2005&sciodt=0,5&hl=en",525,"2023-02-08 13:47:29","PDF","","","",,,,,2,0.22,1,2,9,"… rate, monetary policy, fiscal policy, economic growth, the per capital income are problems which require good knowledge of statistics. Monetary policy is the … Monetary policy rests on the …","https://www.ijiset.com/v1s6/IJISET_V1_I6_22.pdf","https://scholar.google.com/scholar?q=related:8qLRTci1y3oJ:scholar.google.com/&scioq=effect+of+%22monetary+policy%22+on+%22economic+growth%22&hl=en&as_sdt=0,5"
40,"R Mangani","The effects of monetary policy on prices in Malawi",2020,"","publication.aercafricalibrary.org","http://publication.aercafricalibrary.org/handle/123456789/518","https://scholar.google.com/scholar?cites=8648242223994512834&as_sdt=2005&sciodt=0,5&hl=en",526,"2023-02-08 13:47:29","","","","",,,,,40,13.33,40,1,3,"… macroeconomic effects of monetary policy. This study assessed the effects of monetary policy in … Moreover, objectives such as economic growth and employment could be influenced by …","http://publication.aercafricalibrary.org/xmlui/bitstream/handle/123456789/518/RP252.pdf?sequence=1","https://scholar.google.com/scholar?q=related:wiW6fHu6BHgJ:scholar.google.com/&scioq=effect+of+%22monetary+policy%22+on+%22economic+growth%22&hl=en&as_sdt=0,5"
0,"KM ALABI","IMPACT OF MONETARY POLICY AND ITS LAG ON ECONOMIC GROWTH (1986-2016)(A COMPARATIVE STUDY OF UK, USA AND NIGERIA)",2017,"","researchgate.net","https://www.researchgate.net/profile/Kehinde-Alabi/publication/341521330_IMPACT_OF_MONETARY_POLICY_AND_ITS_LAG_ON_ECONOMIC_GROWTH_1986-2016_A_COMPARATIVE_STUDY_OF_UK_USA_AND_NIGERIA/links/5ec53d89458515626cb89b5f/IMPACT-OF-MONETARY-POLICY-AND-ITS-LAG-ON-ECONOMIC-GROWTH-1986-2016-A-COMPARATIVE-STUDY-OF-UK-USA-AND-NIGERIA.pdf","",527,"2023-02-08 13:47:29","PDF","","","",,,,,0,0.00,0,1,6,"… technique is employed to assess the effect of monetary policy lag on economic growth. … what effect does monetary policy lag have on economic growth in the long run? … Monetary …","https://www.researchgate.net/profile/Kehinde-Alabi/publication/341521330_IMPACT_OF_MONETARY_POLICY_AND_ITS_LAG_ON_ECONOMIC_GROWTH_1986-2016_A_COMPARATIVE_STUDY_OF_UK_USA_AND_NIGERIA/links/5ec53d89458515626cb89b5f/IMPACT-OF-MONETARY-POLICY-AND-ITS-LAG-ON-ECONOMIC-GROWTH-1986-2016-A-COMPARATIVE-STUDY-OF-UK-USA-AND-NIGERIA.pdf","https://scholar.google.com/scholar?q=related:EsRmunI66_AJ:scholar.google.com/&scioq=effect+of+%22monetary+policy%22+on+%22economic+growth%22&hl=en&as_sdt=0,5"
35,"MJ Fry, DM Lilien","Monetary policy responses to exogenous shocks",1986,"The American Economic Review","JSTOR","https://www.jstor.org/stable/1818740","https://scholar.google.com/scholar?cites=429465068623843878&as_sdt=2005&sciodt=0,5&hl=en",528,"2023-02-08 13:47:29","","","","",,,,,35,0.95,18,2,37,"… economic growth, we take MA CC74, to indicate a country's willingness to use monetary policy … Few would doubt that monetary accommodation can reduce the negative impact of supply …","","https://scholar.google.com/scholar?q=related:JlLDWjTE9QUJ:scholar.google.com/&scioq=effect+of+%22monetary+policy%22+on+%22economic+growth%22&hl=en&as_sdt=0,5"
5,"E Makori, E Matundura, N Mose","Effect of fiscal and monetary policy on gross domestic savings in Kenya",2022,"Makori, E., Matundura, E., and …","researchgate.net","https://www.researchgate.net/profile/Naftaly-Mose/publication/358415101_Effect_of_Fiscal_and_Monetary_Policy_on_Gross_Domestic_Savings_in_Kenya/links/6201680180f0ea5eb53437df/Effect-of-Fiscal-and-Monetary-Policy-on-Gross-Domestic-Savings-in-Kenya.pdf?_sg%5B0%5D=started_experiment_milestone&origin=journalDetail&_rtd=e30%3D","https://scholar.google.com/scholar?cites=1806963089791140215&as_sdt=2005&sciodt=0,5&hl=en",529,"2023-02-08 13:47:29","PDF","","","",,,,,5,5.00,2,3,1,"… It is thus essential that internal savings capacity in these economies is increased to enhance investment financing and economic growth. Since increased reliance on external capital …","https://www.researchgate.net/profile/Naftaly-Mose/publication/358415101_Effect_of_Fiscal_and_Monetary_Policy_on_Gross_Domestic_Savings_in_Kenya/links/6201680180f0ea5eb53437df/Effect-of-Fiscal-and-Monetary-Policy-on-Gross-Domestic-Savings-in-Kenya.pdf?_sg%5B0%5D=started_experiment_milestone&origin=journalDetail&_rtd=e30%3D","https://scholar.google.com/scholar?q=related:d0E-QVufExkJ:scholar.google.com/&scioq=effect+of+%22monetary+policy%22+on+%22economic+growth%22&hl=en&as_sdt=0,5"
82,"SK Lenka, AK Bairwa","Does financial inclusion affect monetary policy in SAARC countries?",2016,"Cogent Economics &Finance","Taylor &Francis","https://www.tandfonline.com/doi/abs/10.1080/23322039.2015.1127011","https://scholar.google.com/scholar?cites=1027259542658596240&as_sdt=2005&sciodt=0,5&hl=en",530,"2023-02-08 13:47:29","","10.1080/23322039.2015.1127011","","",,,,,82,11.71,41,2,7,"… economic growth of the countries. However, no study has found the relationship between financial inclusion and its effect on the monetary policy … study to explore the impact of financial …","https://www.tandfonline.com/doi/pdf/10.1080/23322039.2015.1127011?needAccess=true&role=button","https://scholar.google.com/scholar?q=related:kL1LhByPQQ4J:scholar.google.com/&scioq=effect+of+%22monetary+policy%22+on+%22economic+growth%22&hl=en&as_sdt=0,5"
